title,summary,full_text
"ಟಿಬಿ ಡ್ಯಾಂ ಪ್ರಾಧಿಕಾರದಲ್ಲಿ ಆಂಧ್ರದ್ದೇ  ಪ್ರಾಬಲ್ಯ, ಕಾಯಂ ಅಧಿಕಾರಿ ನೇಮಕಕ್ಕೆ ರಾಜ್ಯ ಸರ್ಕಾರ ಧ್ವನಿ ಎತ್ತಲಿ","ತುಂಗಭದ್ರಾ ಮಂಡಳಿಯಲ್ಲಿ ಆಂಧ್ರಪ್ರದೇಶದ ಪ್ರಾಬಲ್ಯವನ್ನು ಕಡಿಮೆ ಮಾಡಲು ಮತ್ತು ಕರ್ನಾಟಕದ ಹಿತಗಳನ್ನು ರಕ್ಷಿಸಲು, ರಾಜ್ಯ ಸರ್ಕಾರವು ತನ್ನ ಮುಖ್ಯ ಎಂಜಿನಿಯರ್ ಅನ್ನು ಮಂಡಳಿಯಲ್ಲಿ ಕಾಯಂ ಅಧಿಕಾರಿಯಾಗಿ ನಿಯೋಜಿಸಬೇಕೆಂದು ರೈತರು ಒತ್ತಾಯಿಸುತ್ತಿದ್ದಾರೆ.","ಕೃಷ್ಣ ಎನ್‌. ಲಮಾಣಿ ಹೊಸಪೇಟೆ (ಆ.19):ತುಂಗಭದ್ರಾ ಮಂಡಳಿಯಲ್ಲಿ (ಟಿಬಿ ಬೋರ್ಡ್‌) ಆಂಧ್ರಪ್ರದೇಶ ಹಿತ ಕಾಪಾಡುವ ಕಾರ್ಯ ನಡೆಯುತ್ತಿದ್ದು, ಇದನ್ನು ತಪ್ಪಿಸಲು ಕರ್ನಾಟಕದ ಜಲ ಸಂಪನ್ಮೂಲ ಇಲಾಖೆಯ ಮುಖ್ಯ ಎಂಜಿನಿಯರ್‌ ಅವರನ್ನು ಮಂಡಳಿಯಲ್ಲಿ ಕಾಯಂ ಅಧಿಕಾರಿಯನ್ನಾಗಿ ನಿಯೋಜನೆಗೆ ರಾಜ್ಯ ಸರ್ಕಾರ ಬೋರ್ಡ್‌ ಮೇಲೆ ಒತ್ತಡ ಹೇರಲಿ ಎಂಬ ಕೂಗು ಈಗ ಈ ಭಾಗದ ರೈತರ ವಲಯದಲ್ಲಿ ಎದ್ದಿದೆ. ಜಲಾಶಯದ ಕ್ರಸ್ಟ್‌ ಗೇಟ್ ನಂ.19ರ ಸರಪಳಿ ತುಂಡಾಗಿ ಗೇಟ್‌ ಕಳಚಿ ಬಿದ್ದ ಬಳಿಕ ಜಲಾಶಯದಿಂದ ನದಿಗೆ 40 ಟಿಎಂಸಿ ನೀರು ವ್ಯರ್ಥವಾಗಿ ಹರಿದು ಹೋಗಿದೆ. ಗೇಟ್‌ನಲ್ಲಿ ತುರ್ತಾಗಿ ಕಾಮಗಾರಿ ನಡೆಸಲು ಜಲಾಶಯದ ನೀಲನಕ್ಷೆ ಕೂಡ ಹೊಸಪೇಟೆಯಲ್ಲಿರುವ ಬೋರ್ಡ್‌ನ ಕಚೇರಿಯಲ್ಲಿ ಇರಲಿಲ್ಲ. ಹೈದರಾಬಾದ್‌ನಲ್ಲಿರುವ ಬೋರ್ಡ್‌ನ ಮುಖ್ಯ ಕಚೇರಿಯಲ್ಲಿದ್ದ ಜಲಾಶಯದ ನೀಲನಕ್ಷೆ ತರಿಸಿಕೊಳ್ಳಲಾಯಿತು. ಜಲಾಶಯದಲ್ಲಿ ತುರ್ತಾಗಿ ಕಾಮಗಾರಿ ನಡೆಸಲು ರಾಜ್ಯ ಸರ್ಕಾರ ಮಂಡಳಿಯಿಂದ ಪರವಾನಗಿ ಕೊಡಿಸಲು ಏದುಸಿರು ಬಿಡುವಂತಾಗಿತ್ತು. ಇದರ ಬದಲಿಗೆ ಜಲ ಸಂಪನ್ಮೂಲ ಇಲಾಖೆಯ ಮುಖ್ಯ ಎಂಜಿನಿಯರ್‌ ಅವರನ್ನು ಮಂಡಳಿಯಲ್ಲಿ ಕಾಯಂ ಅಧಿಕಾರಿಯನ್ನಾಗಿ ನಿಯೋಜಿಸಿದರೆ ರಾಜ್ಯ ಸರ್ಕಾರ ಕೂಡ ಬೋರ್ಡ್‌ನಲ್ಲಿ ಹಿಡಿತ ಸಾಧಿಸಲಿದೆ ಎಂಬುದು ಜಲಾಶಯ ನೆಚ್ಚಿರುವ ರೈತರ ವಾದವಾಗಿದೆ. ಗಮನಿಸಿ, ನಾಳೆಯಿಂದ ನಮ್ಮ ಮೆಟ್ರೋ ಈ ಮಾರ್ಗದಲ್ಲಿ ಸೇವೆ ವ್ಯತ್ಯಯ, ಕೆಲವು ನಿಲ್ದಾಣದಲ್ಲಿ ಸಂಚಾರವೇ ರದ್ದು ಈಗ ಗೌರವ ಅಧಿಕಾರಿ:ಬಚಾವತ್‌ ಆಯೋಗದ ಪ್ರಕಾರ ತುಂಗಭದ್ರಾ ಮಂಡಳಿ ರಚನೆಯಾಗಿದೆ. ಈ ಮಂಡಳಿ ಜಲಾಶಯದ ಭದ್ರತೆ ಹಾಗೂ ನಿರ್ವಹಣೆ ಜವಾಬ್ದಾರಿ ವಹಿಸಿಕೊಂಡಿದೆ. ಕೇಂದ್ರ ಜಲ ಆಯೋಗ (ಸಿಡಬ್ಲ್ಯುಸಿ) ಮುಖ್ಯ ಎಂಜಿನಿಯರ್‌ ಅರ್ಹತೆ ಹೊಂದಿರುವವರನ್ನು ಮಂಡಳಿ ಅಧ್ಯಕ್ಷರನ್ನಾಗಿ ಹಾಗೂ ಕಾರ್ಯದರ್ಶಿಯನ್ನಾಗಿ ನೇಮಿಸುತ್ತದೆ. ಈ ಮಂಡಳಿಯಲ್ಲಿ ಕರ್ನಾಟಕ, ಆಂಧ್ರಪ್ರದೇಶ, ತೆಲಂಗಾಣ ರಾಜ್ಯಗಳ ನೀರಾವರಿ ಇಲಾಖೆ ಕಾರ್ಯದರ್ಶಿಗಳು ಸದಸ್ಯರಾಗಿರುತ್ತಾರೆ. ಕರ್ನಾಟಕದ ನೀರಾವರಿ ಇಲಾಖೆಯ ಮುಖ್ಯ ಎಂಜಿನಿಯರ್‌ ಗೌರವ ಅಧಿಕಾರಿಯಾಗಿರುತ್ತಾರೆ. ಆದರೆ, ಈ ಅಧಿಕಾರಿಯನ್ನು ಕಾಯಂ ಅಧಿಕಾರಿಯನ್ನಾಗಿ ನೇಮಿಸಿದರೆ ಮಂಡಳಿಯಲ್ಲಿ ನಡೆಯುವ ಆಗು-ಹೋಗುಗಳು ರಾಜ್ಯಕ್ಕೆ ಸ್ಪಷ್ಟವಾಗಿ ತಿಳಿಯಲಿದೆ. ಜತೆಗೆ ಪಾರದರ್ಶಕತೆ ಕಾಪಾಡಿಕೊಳ್ಳಲು ಸಾಧ್ಯವಾಗಲಿದೆ ಎಂಬುದು ಜಲಾಶಯ ನೆಚ್ಚಿರುವ ರೈತರು ''''ಕನ್ನಡಪ್ರಭ''''ಕ್ಕೆ ತಿಳಿಸಿದ್ದಾರೆ. ನಂದಿಬೆಟ್ಟ ರೋಪ್ ವೇ ಯೋಜನೆಗೆ 2 ಎಕರೆ ಭೂಮಿ ಮಂಜೂರು ಮಾಡಿ ರಾಜ್ಯ ಸರ್ಕಾರ ಆದೇಶ ಅನುದಾನ ನೀಡಿಕೆಯಲ್ಲಿ ರಾಜ್ಯದ ಪಾಲು ಹೆಚ್ಚು:ತುಂಗಭದ್ರಾ ಮಂಡಳಿಗೆ ರಾಜ್ಯ ಸರ್ಕಾರ ನಿರ್ವಹಣೆ ಹಾಗೂ ಭದ್ರತೆಗೆ ಶೇ. 65 ಅನುದಾನ ಒದಗಿಸುತ್ತದೆ. ಆಂಧ್ರಪ್ರದೇಶದ ಪಾಲು ಶೇ. 35ರಷ್ಟಿದೆ. ಹೀಗಿದ್ದರೂ ರಾಜ್ಯದ ಹಿಡಿತ ಮಂಡಳಿಯ ಮೇಲಿಲ್ಲ. ಈ ಮಂಡಳಿಗೆ ಆಂಧ್ರಪ್ರದೇಶ ಅಧೀಕ್ಷಕ ಎಂಜಿನಿಯರ್‌ನ್ನು ನಿಯೋಜನೆ ಮಾಡುತ್ತದೆ. ಈ ಅಧೀಕ್ಷಕ ಎಂಜಿನಿಯರ್‌ ಅವರದ್ದೇ ಮಂಡಳಿಯಲ್ಲಿ ಹೆಚ್ಚಿನ ಕಾರುಬಾರು ನಡೆಯುತ್ತದೆ. ತೆಲಂಗಾಣ ಹಾಗೂ ಕರ್ನಾಟಕದ ಅಧೀಕ್ಷಕ ಎಂಜಿನಿಯರ್‌ಗಳು ನೀರಿನ ಹಂಚಿಕೆ ವಿಷಯದಲ್ಲಿ ಚರ್ಚೆ ನಡೆಸಿದರೂ ಆಂಧ್ರಪ್ರದೇಶದ ಅಧೀಕ್ಷಕ ಎಂಜಿನಿಯರ್‌ ನಿರ್ಧಾರ ತೆಗೆದುಕೊಳ್ಳುತ್ತಾರೆ ಎಂಬುದು ರಾಜ್ಯದ ರೈತರ ಅಳಲು. ಸಮನಾಂತರ ಜಲಾಶಯ ನಿರ್ಮಾಣಕ್ಕೂ ತೊಡಕು:ಜಲಾಶಯದಲ್ಲಿ 30 ಟಿಎಂಸಿಯಷ್ಟು ಹೂಳು ತುಂಬಿದೆ. ಕೊಪ್ಪಳದ ಗಂಗಾವತಿ ಬಳಿಯ ನವಲಿ ಬಳಿ ಸಮನಾಂತರ ಜಲಾಶಯ ನಿರ್ಮಾಣ ಮಾಡಬೇಕು ಎಂಬುದು ದಶಕಗಳ ಕೂಗಾಗಿದೆ. ಆದರೆ, ತುಂಗಭದ್ರಾ ಮಂಡಳಿಯಲ್ಲಿ ಈ ಕಾರ್ಯಕ್ಕೆ ವೇಗ ದೊರೆಯದ್ದರಿಂದ ಕರ್ನಾಟಕ ಸರ್ಕಾರ ಡಿಪಿಆರ್‌ ತಯಾರಿ ಮಾಡಿಕೊಂಡರೂ ಆಂಧ್ರಪ್ರದೇಶ, ತೆಲಂಗಾಣ ರಾಜ್ಯಗಳ ಮುಖ್ಯಮಂತ್ರಿಗಳ ಒಪ್ಪಿಗೆಗೆ ಕಾಯುವಂತಾಗಿದೆ. ಹಾಗಾಗಿ ಕರ್ನಾಟಕದ ಮುಖ್ಯ ಎಂಜಿನಿಯರ್‌ ಅವರನ್ನು ಮಂಡಳಿಗೆ ಕಾಯಂ ಅಧಿಕಾರಿಯನ್ನಾಗಿ ನಿಯೋಜಿಸಿದರೆ ಕರ್ನಾಟಕದ ಯೋಜನೆಗಳಿಗೆ ಆಗುತ್ತಿರುವ ಅಡ್ಡಿ ನಿವಾರಣೆ ಆಗಲಿದೆ ಎಂಬುದು ಈ ಭಾಗದ ರೈತರ ಅಭಿಪ್ರಾಯವಾಗಿದೆ. ಕರ್ನಾಟಕದ ಮುಖ್ಯ ಎಂಜಿನಿಯರ್‌ ಅವರನ್ನು ಮಂಡಳಿಗೆ ಕಾಯಂ ಅಧಿಕಾರಿಯನ್ನಾಗಿ ನಿಯೋಜನೆ ಮಾಡಿದರೆ, ತುಂಗಭದ್ರಾ ಜಲಾಶಯದ ಕ್ರಸ್ಟ್‌ ಗೇಟ್‌ಗಳ ಮರು ನಿರ್ಮಾಣ, ಜಲಾಶಯ ಬಲವರ್ಧನೆಗೊಳಿಸುವ ಕಾರ್ಯಗಳು ಸೇರಿದಂತೆ ಇತರ ಯೋಜನೆಗಳಿಗೆ ಮಂಡಳಿಯಲ್ಲಿ ರಾಜ್ಯದ ಪಾತ್ರ ಮಹತ್ವ ಪಡೆಯಲಿದೆ. ಹಾಗಾಗಿ ಈ ಕಾರ್ಯವನ್ನು ರಾಜ್ಯ ಸರ್ಕಾರ ತುರ್ತಾಗಿ ಮಾಡಲಿ ಎಂಬುದು ಜಲಾಶಯ ನೆಚ್ಚಿರುವ ರೈತರ ಆಗ್ರಹವೂ ಆಗಿದೆ.ತುಂಗಭದ್ರಾ ಮಂಡಳಿಗೆ ರಾಜ್ಯ ಸರ್ಕಾರ ಶೇ. 65ರಷ್ಟು ಅನುದಾನ ನೀಡಿದರೂ ರಾಜ್ಯದ ಅಧಿಕಾರ ಮಂಡಳಿಯ ಮೇಲಿಲ್ಲ. ಆಂಧ್ರಪ್ರದೇಶದ ಹಿಡಿತ ತಪ್ಪಿಸಲು ಕರ್ನಾಟಕದ ಮುಖ್ಯ ಎಂಜಿನಿಯರ್‌ ಅವರನ್ನು ಮಂಡಳಿಗೆ ಕಾಯಂ ಅಧಿಕಾರಿಯನ್ನಾಗಿ ನಿಯೋಜನೆ ಮಾಡಬೇಕಿದೆ. ಈ ಕಾರ್ಯ ತುರ್ತಾಗಿ ಆಗಬೇಕಿದೆ ಎನ್ನುತ್ತಾರೆ ಕೃಷಿ ಬೆಲೆ ಆಯೋಗದ ಮಾಜಿ ಅಧ್ಯಕ್ಷ ಹನುಮನಗೌಡ ಬೇಳಗುರ್ಕಿ."
ಡಾರ್ಲಿಂಗ್ ಪ್ರಭಾಸ್-ಹನು ರಾಘವಪುಡಿ ಹೊಸ ಸಿನಿಮಾ ಶುರುವಾಯ್ತು; ಶುಭ ಹಾರೈಸಿದ್ದು ಯಾರು ಗೊತ್ತಾ?,ಪ್ರಭಾಸ್ ಗೆ ಜೋಡಿಯಾಗಿ ಸೋಶಿಯಲ್ ಮೀಡಿಯಾ ಇನ್‌ಫ್ಲುಯೆನ್ಸರ್ ಕಂ ಡ್ಯಾನ್ಸರ್ ಇಮಾನ್ವಿ ಈ ಚಿತ್ರದಲ್ಲಿ ನಾಯಕಿಯಾಗಿ ಸಾಥ್ ಕೊಡುತ್ತಿದ್ದಾರೆ. 1940ರ ದಶಕದ ಕಥೆಯನ್ನು ಹನು ರಾಘವಪುಡಿ ಪ್ರೇಕ್ಷಕರ ಎದುರು ಪ್ರಸ್ತುತಪಡಿಸಲಿದ್ದಾರೆ. ಬಾಲಿವುಡ್ ದಿಗ್ಗಜ ..,"ಡಾರ್ಲಿಂಗ್ ಪ್ರಭಾಸ್ (Darling Prabhas) ಯಾರಿಗೆ ಗೊತ್ತಿಲ್ಲ? ಎಸ್‌ಎಸ್‌ ರಾಜಮೌಳಿ ನಿರ್ದೇಶನದ ಬಾಹುಬಲಿ ಸಿನಿಮಾದ ಬಳಿಕ ನಟ ಪ್ರಭಾಸ್ ಎಂದರೆ ಇಡೀ ಜಗತ್ತಿಗೇ ಗೊತ್ತು. ಬಾಹುಬಲಿ ನಂತರ ನಟ ಪ್ರಭಾಸ್ ಪ್ಯಾನ್ ಇಂಡಿಯಾ ಸ್ಟಾರ್ ಆಗಿ ಗುರುತಿಸಿಕೊಂಡಿದ್ದಾರೆ. ಅವರ ಸಿನಿಮಾಗಳು ಎಲ್ಲವೂ ಹೈ ಬಜೆಟ್ ಸಿನಿಮಾಗಳೇ ಆಗಿವೆ. ಆದರೆ, ರಾಧೆ ಶ್ಯಾಮ್, ಆದಿ ಪುರುಷ್ ಮುಂತಾದ ಸಿನಿಮಾಗಳು ಸೋತಿವೆ, ಸಲಾರ್, ಕಲ್ಕಿ ಸಿನಿಮಾಗಳು ಗೆದ್ದಿವೆ. ಇತ್ತೀಚೆಗಷ್ಟೇ ಬಿಡುಗಡೆ ಕಂಡು ಕಲ್ಕಿ ಸಿನಿಮಾ ಸೂಪರ್ ಹಿಟ್ ದಾಖಲಿಸಿದೆ. ಪ್ರಭಾಸ್ ನಟನೆಯಲ್ಲಿ ಅದಕ್ಕೂ ಮೊದಲು ಮೂಡಿ ಬಂದಿದ್ದ, ಕನ್ನಡಿಗ ಪ್ರಶಾಂತ್ ನೀಲ್ ನಿರ್ದೇಶನದ ಸಲಾರ್ ಚಿತ್ರ ಕೂಡ ಸೂಪರ್ ಹಿಟ್ ಆಗಿತ್ತು. ಈ ಮೂಲಕ ಸದ್ಯ ನಟ ಪ್ರಭಾಸ್ ಅವರು ಹಿಟ್ ಸಿನಿಮಾಗಳನ್ನು ನೀಡುತ್ತಿರುವ ಭಾರತದ ಸ್ಟಾರ್ ನಟರಾಗಿ ಮಿಂಚುತ್ತಿದ್ದಾರೆ. ಇದೀಗ, ಸೀತಾರಾಮಂ ಎಂಬ ಸೂಪರ್ ಹಿಟ್ ಸಿನಿಮಾ ನೀಡಿದ್ದ ಹನು ರಾಘವಪುಡಿ ಜೊತೆ ಹೊಸ ಸಿನಿಮಾಗೆ ಜೈ ಎಂದಿದ್ದಾರೆ. ಮೇರು ಕಲಾವಿದ ನರಸಿಂಹರಾಜು ಕೊರಗುತ್ತ ಕುಗ್ಗಿಹೋಗಿ ಇಹಲೋಕ ತ್ಯಜಿಸಿದ್ದು ಈ ಕಾರಣಕ್ಕೆ..! ಸಲಾರ್ ಹಾಗೂ ಕಲ್ಕಿ 2898AD ಸೂಪರ್ ಸಕ್ಸಸ್ ಬೆನ್ನಲ್ಲೇ ಡಾರ್ಲಿಂಗ್ ಪ್ರಭಾಸ್ ಹೊಸ ಸಿನಿಮಾ ಸೆಟ್ಟೇರಿದೆ. ಹೈದರಾಬಾದ್‌ನಲ್ಲಿಂದು ಚಿತ್ರಕ್ಕೆ ಮುಹೂರ್ತ ನೆರವೇರಿದ್ದು, ಸಲಾರ್ ನಿರ್ದೇಶಕ ಪ್ರಶಾಂತ್ ನೀಲ್ ಸಮಾರಂಭದಲ್ಲಿ ಕಾಣಿಸಿಕೊಂಡಿದ್ದಾರೆ. 'ಸೀತಾರಾಮಂ' ಸಿನಿಮಾ ನಿರ್ದೇಶಿಸಿ ಯಶಸ್ಸು ಕಂಡಿರುವ ಹನು ರಾಘವಪುಡಿ ಪ್ರಭಾಸ್ ಆಕ್ಷನ್ ಕಟ್ ಹೇಳುತ್ತಿದ್ದಾರೆ. ಸದ್ಯಕ್ಕೆ '#ಪ್ರಭಾಸ್ ಹನು' ಎಂದು ತಾತ್ಕಾಲಿಕವಾಗಿ ಟೈಟಲ್ ಇಡಲಾಗಿದೆ. ದಕ್ಷಿಣ ಚಿತ್ರರಂಗದ ಪ್ರತಿಷ್ಠಿತ ನಿರ್ಮಾಣ ಸಂಸ್ಥೆ ಮೈತ್ರಿ ಮೂವೀ ಮೇಕರ್ಸ್ ಬ್ಯಾನರ್ ನಡಿ ನವೀನ್ ಯೆರ್ನೇನಿ ಮತ್ತು ವೈ ರವಿಶಂಕರ್ ಚಿತ್ರ ನಿರ್ಮಾಣ ಮಾಡುತ್ತಿದ್ದಾರೆ. ಪ್ರಭಾಸ್ ಗೆ ಜೋಡಿಯಾಗಿ ಸೋಶಿಯಲ್ ಮೀಡಿಯಾ ಇನ್‌ಫ್ಲುಯೆನ್ಸರ್ ಕಂ ಡ್ಯಾನ್ಸರ್ ಇಮಾನ್ವಿ ಈ ಚಿತ್ರದಲ್ಲಿ ನಾಯಕಿಯಾಗಿ ಸಾಥ್ ಕೊಡುತ್ತಿದ್ದಾರೆ. 1940ರ ದಶಕದ ಕಥೆಯನ್ನು ಹನು ರಾಘವಪುಡಿ ಪ್ರೇಕ್ಷಕರ ಎದುರು ಪ್ರಸ್ತುತಪಡಿಸಲಿದ್ದಾರೆ. ಬಾಲಿವುಡ್ ದಿಗ್ಗಜ ಮಿಥುನ್ ಚಕ್ರವರ್ತಿ ಮತ್ತು ಜಯಪ್ರದಾ ಪ್ರಮುಖ ಪಾತ್ರಗಳಲ್ಲಿ ನಟಿಸಲಿದ್ದಾರೆ. ಶಂಕರ್‌ ನಾಗ್-ಅರುಂಧತಿ ನಾಗ್ ಒಮ್ಮೆ ಮದುವೆ ಆಗದಿರಲು ನಿರ್ಧರಿಸಿದ್ದು ಯಾಕೆ? ಕಾರಣ ಏನಾಗಿತ್ತು..? ಸುದೀಪ್ ಚಟರ್ಜಿ ಐಎಸ್‌ಸಿ ಛಾಯಾಗ್ರಹಣ, ವಿಶಾಲ್ ಚಂದ್ರಶೇಖರ್ ಸಂಗೀತ, ಕೋಟಗಿರಿ ವೆಂಕಟೇಶ್ವರ ರಾವ್ ಸಂಕಲನ ಚಿತ್ರಕ್ಕಿದೆ. ಶೀಘ್ರದಲ್ಲಿಯೇ ಪ್ರಭಾಸ್ ಹಾಗೂ ಹನು ರಾಘವಪುಡಿ ಹೊಸ ಚಿತ್ರದ ಚಿತ್ರೀಕರಣ ಆರಂಭವಾಗಲಿದೆ."
"ಸಾರಿಗೆ ಬಸ್‌ನಲ್ಲಿ ಭೂತ ಪ್ರಯಾಣ, ಸಿಸಿಟಿವಿಯಲ್ಲಿ ಪತ್ತೆಯಾದ ಅದೃಶ್ಯ ವ್ಯಕ್ತಿಯ ಸೆರೆ ಹಿಡಿದ ಕಂಡಕ್ಟರ್!",ಸಿಟಿ ಬಸ್‌ನಲ್ಲಿ ವಿಚಿತ್ರ ಘಟನೆ ನಡೆದಿದೆ.ಬಸ್ ಸೀಟಿನಲ್ಲಿ ಅದೃಶ್ಯ ವ್ಯಕ್ತಿಯೊಬ್ಬರು ಕುಳಿತಿರುವ ಚಿತ್ರ ಬಸ್ ಸಿಸಿಟಿವಿಯಲ್ಲಿ ಸೆರೆಯಾಗಿದೆ. ಸಾರಿಗೆ ಬಸ್‌ನಲ್ಲಿ ಭೂತ ಪ್ರಯಾಣ ಮಾಡುತ್ತಿರುವ ಈ ವಿಡಿಯೋವನ್ನು ಕಂಡಕ್ಟರ್ ಸೆರೆ ಹಿಡಿದ್ದಾರೆ.,"ದೆಹಲಿ(ಆ.15) ಸಾರಿಗೆ ಬಸ್‌ನಲ್ಲಿ ಭೂತದ ಪ್ರಯಾಣ ಮಾಡಿರುವ ವಿಚಿತ್ರ ಘಟನೆ ದೆಹಲಿಯಲ್ಲಿ ವರದಿಯಾಗಿದೆ. ರಾತ್ರಿ ವೇಳೆ ಈ ಘಟನೆ ನಡೆದಿದೆ. ಬಸ್ ನಿಲ್ಲಿಸಿದ ಬಳಿಕ ಕಂಡಕ್ಟರ್ ನಿತ್ಯದ ಕೆಲಸದಂತೆ ಸಂಪೂರ್ಣ ಬಸ್ ಪರಿಶೀಲಿಸಿದ್ದಾರೆ. ಈ ವೇಳೆ ಎಲ್ಲಾ ಸೀಟುಗಳು ಖಾಲಿ ಖಾಲಿಯಾಗಿತ್ತು. ಆದರೆ ಡ್ರೈವರ್ ಪಕ್ಕದಲಿರುವ ಸಿಸಿಟಿವಿ ದೃಶ್ಯದಲ್ಲಿ ಸೀಟಿನಲ್ಲಿ ವ್ಯಕ್ತಿಯೊಬ್ಬರು ಕುಳಿತಿರುವು ದೃಶ್ಯ ಪತ್ತೆಯಾಗಿದೆ. ಮತ್ತೆ ಸೀಟಿನ ಬಳಿ ಬಂದರೆ ಯಾರೂ ಇಲ್ಲ. ಈ ವಿಡಿಯೋವನ್ನು ಕಂಡಕ್ಟರ್ ರೆಕಾರ್ಡ್ ಮಾಡಿದ್ದಾರೆ. ಇದೀಗ ಈ ವಿಡಿಯೋ ದೆಹಲಿ ಸಿಟಿ ಬಸ್‌ನಲ್ಲಿ ಭೂತ ಪ್ರಯಾಣ ಮಾಡುತ್ತಿದೆ ಅನ್ನೋ ಚರ್ಚೆ ಹುಟ್ಟು ಹಾಕಿದೆ. ಬಿಇನ್ ಫಾರೆವರ್ ಅನ್ನೋ ಸೋಶಿಯಲ್ ಮೀಡಿಯಾ ಖಾತೆಯಲ್ಲಿ ಈ ವಿಡಿಯೋ ಹಂಚಿಕೊಳ್ಳಲಾಗಿದೆ. ಈ ವಿಡಿಯೋದಲ್ಲಿ ಸಾರಿಗೆ ಬಸ್‌ನಲ್ಲಿ ಭೂತ ಪ್ರತ್ಯಕ್ಷ ಎಂದು ಉಲ್ಲೇಖಿಸಿದ್ದಾರೆ. ಘಟನೆ ಕುರಿತು ವಿವರಣೆಯನ್ನೂ ನೀಡಲಾಗಿದೆ. ದೆಹಲಿಯ ಸಾರಿಗೆ ಬಸ್ ದಿನದ ಕರ್ತವ್ಯ ಮುಗಿಸಿದ ಬಳಿಕ ನಿಲ್ದಾಣದಲ್ಲಿ ನಿಲ್ಲಿಸಲಾಗಿದೆ. ಮಧ್ಯ ರಾತ್ರಿಯಲ್ಲಿ ಬಸ್ ಪಾರ್ಕ್ ಮಾಡಿದ ಬಳಿಕ ಕಂಡಕ್ಟರ್, ಬಸ್ ಪರಿಶೀಲಿಸುತ್ತಾರೆ. ಇದು ಸಾಮಾನ್ಯ ಪ್ರಕ್ರಿಯೆ. ಇದೇ ರೀತಿ ಬಸ್ ಪರಿಶೀಲಿದ ಕಂಡಕ್ಟರ್‌ಗೆ ಭೂತದ ಅನುಭವವಾಗಿದೆ ಎಂದು ಹೇಳಲಾಗಿದೆ. ಸ್ಮಶಾನದ ಪಕ್ಕದಲ್ಲಿರುವ ರಾಜಸ್ಥಾನ ವಿಧಾನಸಭೆಗೆ ಭೂತದ ಕಾಟ, 200 ಸಂಖ್ಯಾಬಲಕ್ಕೆ ಸಾವಿನ ಶಾಕ್! ಸಂಪೂರ್ಣ ಬಸ್ ಪರಿಶೀಲನೆ ವೇಳೆ ಎಲ್ಲಾ ಸೀಟುಗಳು ಖಾಲಿ ಖಾಲಿಯಾಗಿತ್ತು. ಆದರೆ ಡ್ರೈವರ್ ಸೀಟು ಬಳಿ ಬರುತ್ತಿದ್ದಂತೆ ಕಂಡಕ್ಟರ್‌ಗೆ ಅಚ್ಚರಿಯಾಗಿದೆ. ಕಾರಣ ಡ್ರೈವರ್ ಸೀಟಿನ ಬಳಿ ಇರುವ ಸಿಸಿಟಿವಿಯಲ್ಲಿ ವ್ಯಕ್ತಿಯೊಬ್ಬರು ಸೀಟಿನಲ್ಲಿ ಕುಳಿತಿರುವಂತೆ ಕಂಡಿದೆ. ಮತ್ತೊಮ್ಮೆ ಪರಿಶೀಲಿಸಿದಾಗ ಸೀಟಿನಲ್ಲಿ ಯಾರೂ ಇಲ್ಲ ಅನ್ನೋ ಖಾತ್ರಿಯಾಗಿದೆ. ಆದರೆ ಸೀಟಿನಲ್ಲಿ ನೀರಿನ ಬಾಟಲಿ ಇಡಲಾಗಿತ್ತು. ಸಿಸಿಟಿವಿಯಲ್ಲಿ ಬಿಳಿ ಶರ್ಟ್ ಧರಿಸಿದ್ದ ವ್ಯಕ್ತಿಯೊಬ್ಬರು ಕುಳಿತಿರುವ ದೃಶ್ಯ ಕಾಣುತ್ತಿದೆ.  A post shared by Bien_forever (@bien_forever)  ಇದು ಭೂತ ಎಂದು ಕಂಡಕ್ಟರ್ ಮೊಬೈಲ್ ಮೂಲಕ ವಿಡಿಯೋ ರೆಕಾರ್ಡ್ ಮಾಡಿದ್ದಾರೆ. ಎರಡೆರಡು ಬಾರಿ ಸೀಟಿನ ಬಳಿ ತೆರಳಿ ಖಾಲಿ ಇರುವುದನ್ನು ಖಾತ್ರಿಪಡಿಸಿಕೊಂಡಿದ್ದಾರೆ. ಆದರೆ ಸಿಸಿಟಿವಿಯಲ್ಲಿ ಮಾತ್ರ ಅದೃಶ್ಯ ವ್ಯಕ್ತಿ ಕಾಣುತ್ತಿದ್ದಾರೆ. ಈ ವಿಡಿಯೋ ಬೆನ್ನಲ್ಲೇ ಭಾರಿ ಚರ್ಚೆ ಶುರುವಾಗಿದೆ. ಇದು ನಕಲಿ ಅನ್ನೋ ವಾದ ಒಂದಡೆಯಾದರೆ, ಮತ್ತೊಂದೆಡೆ ಇತ್ತೀಚೆಗೆ ಮಹಿಳೆಯೊಬ್ಬರು ರಾತ್ರಿ ವೇಳೆ ದೆಹಲಿ ಸಾರಿಗೆ ಬಸ್‌ನಲ್ಲಿ ಪ್ರಯಾಣಿಸಿದ ಘಟನೆ ನಡೆದಿದೆ ಎಂದು ಕೆಲವರು ವರದಿ ಮಾಡಿದ್ದಾರೆ. ದೆಹಲಿ ಬಸ್‌ನಲ್ಲಿ ಭೂತ ಪ್ರಯಾಣಿಸುತ್ತಿದೆ ಎಂದು ಆರೋಪಿಸಿದ್ದಾರೆ. ಅಪಘಾತದಲ್ಲಿ ಮೃತಪಟ್ಟ ಬಾಯ್‌ಫ್ರೆಂಡ್ ಭೂತದ ಜೊತೆ ಮದುವೆ: ಗೆಳತಿ ನಿರ್ಧಾರಕ್ಕೆ ಭಾರಿ ಮೆಚ್ಚುಗೆ!"
