title,summary,full_text
"ಇಂದಿರಾ ಗಾಂಧಿಯಂತೆ ಮಮತಾ ಬ್ಯಾನರ್ಜಿಯನ್ನು ಕೊಲ್ಲಿ: ಪ್ರಚೋದನಕಾರಿ ಪೋಸ್ಟ್, ವಿದ್ಯಾರ್ಥಿನಿ ಬಂಧನ",ಮಮತಾ ಮಮತಾ ಬ್ಯಾನರ್ಜಿಯನ್ನು ಮಾಡುವಂತೆ ಜನರನ್ನು ಪ್ರಚೋದಿಸಿದ ವಿದ್ಯಾರ್ಥಿಯ.ಪೋಸ್ಟ್‌ನಲ್ಲಿ ಪೋಸ್ಟ್‌ನಲ್ಲಿ ಪ್ರಧಾನಿ ಇಂದಿರಾ ಹತ್ಯೆಯನ್ನು ಉಲ್ಲೇಖಿಸಿದ ಕೀರ್ತಿ ಶರ್ಮಾ ಮಮತಾ ಬ್ಯಾನರ್ಜಿಯವರನ್ನೂ ಅದೇ ಕೊಲ್ಲುವ ಕೊಲ್ಲುವ.,"ಕೋಲ್ಕತ್ತಾ: ಪಶ್ಚಿಮ ಬಂಗಾಳ ಮುಖ್ಯಮಂತ್ರಿ ಮಮತಾ ಬ್ಯಾನರ್ಜಿ ವಿರುದ್ಧ ಆಕ್ಷೇಪಾರ್ಹ ಹೇಳಿಕೆ ನೀಡಿದ ವಿದ್ಯಾರ್ಥಿನಿಯನ್ನು ಕೋಲ್ಕತ್ತಾ ಪೊಲೀಸರು ಬಂಧಿಸಿದ್ದಾರೆ. ಆರ್‌ಜಿ ಕರ್ ವೈದ್ಯಕೀಯ ಕಾಲೇಜು ಮತ್ತು ಆಸ್ಪತ್ರೆಯಲ್ಲಿ 31 ವರ್ಷದ ಟ್ರೈನಿ ವೈದ್ಯೆಯ ಮೇಲೆ ಅತ್ಯಾಚಾರ ಮತ್ತು ಕೊಲೆ ಪ್ರಕರಣಕ್ಕೆ ಸಂಬಂಧಿಸಿದಂತೆ ಸಾಮಾಜಿಕ ಜಾಲತಾಣಗಳಲ್ಲಿ ಹಿಂಸಾಚಾರಕ್ಕೆ ಪ್ರಚೋದನೆ ನೀಡುವ ಪೋಸ್ಟ್ ಹಾಕಿರುವ ಆರೋಪ ವಿದ್ಯಾರ್ಥಿನಿಯ ಮೇಲಿದೆ. 'ಕೀರ್ತಿ ಸೋಶಿಯಲ್' ಎಂಬ ಇನ್‌ಸ್ಟಾಗ್ರಾಮ್ ಪುಟದಲ್ಲಿ ವಿದ್ಯಾರ್ಥಿನಿ ಪೋಸ್ಟ್ ಹಾಕಿದ್ದರು..ಮುಖ್ಯಮಂತ್ರಿ ಮಮತಾ ಬ್ಯಾನರ್ಜಿಯನ್ನು ಕೊಲೆ ಮಾಡುವಂತೆ ಜನರನ್ನು ಪ್ರಚೋದಿಸಿದ ಆರೋಪ ವಿದ್ಯಾರ್ಥಿಯ ಮೇಲಿದೆ. ತಮ್ಮ ಪೋಸ್ಟ್‌ನಲ್ಲಿ ಮಾಜಿ ಪ್ರಧಾನಿ ಇಂದಿರಾ ಗಾಂಧಿ ಹತ್ಯೆಯನ್ನು ಉಲ್ಲೇಖಿಸಿದ ಕೀರ್ತಿ ಶರ್ಮಾ ಮಮತಾ ಬ್ಯಾನರ್ಜಿಯವರನ್ನೂ ಅದೇ ರೀತಿಯಲ್ಲಿ ಕೊಲ್ಲುವ ಬಗ್ಗೆ ಮಾತನಾಡಿದ್ದರು. ಇನ್ನು ವೈದ್ಯೆಯ ಅತ್ಯಾಚಾರ ಮತ್ತು ಕೊಲೆ ಪ್ರಕರಣ ದೇಶಾದ್ಯಂತ ಆಕ್ರೋಶಕ್ಕೆ ಕಾರಣವಾಗಿದ್ದು, ಸಂರಕ್ಷಣೆಗೆ ಆಗ್ರಹಿಸಿ ಆರೋಗ್ಯ ಕಾರ್ಯಕರ್ತರು ಪ್ರತಿಭಟನೆ ನಡೆಸುತ್ತಿದ್ದಾರೆ..ಹತ್ಯೆ, ಅತ್ಯಾಚಾರದ ಸಂತ್ರಸ್ತ ವೈದ್ಯೆಯ ಫೋಟೋ ಹಂಚಿದ್ದಕ್ಕೆ ವ್ಯಕ್ತಿಯ ಬಂಧನ.ಈ ಬಗ್ಗೆ ಟಿಎಂಸಿ ಸಂಸದೆ ಸಾಗರಿಕಾ ಘೋಷ್ ಟ್ವಿಟರ್‌ನಲ್ಲಿ ಮಾಹಿತಿ ನೀಡಿದ್ದಾರೆ. ಕೀರ್ತಿ ಶರ್ಮಾ ಅವರ ಇನ್‌ಸ್ಟಾಗ್ರಾಮ್ ಪೋಸ್ಟ್‌ನ ಸ್ಕ್ರೀನ್‌ಶಾಟ್ ಅನ್ನು ಹಂಚಿಕೊಂಡು ಆಕೆಯ ವಿರುದ್ಧ ಕ್ರಮಕೈಗೊಳ್ಳುವಂತೆ ಕೋಲ್ಕತ್ತಾ ಪೊಲೀಸರನ್ನು ಒತ್ತಾಯಿಸಿದ್ದರು. ಇಂದಿರಾ ಗಾಂಧಿಯವರಂತೆ ಮಮತಾ ಬ್ಯಾನರ್ಜಿ ಅವರನ್ನು ಶೂಟ್ ಮಾಡಿ ಎಂದು ಪೋಸ್ಟ್‌ನಲ್ಲಿ ಬರೆಯಲಾಗಿದೆ..Follow KannadaPrabha channel on WhatsApp  KannadaPrabha News app ಡೌನ್‌ಲೋಡ್ ಮಾಡಿ, ಇತ್ತೀಚಿನ ಸುದ್ದಿಗಳ ಅಪ್ಡೇಟ್ಸ್ ಪಡೆಯಿರಿ"
ಚೆನ್ನೈ: ಮಾಜಿ ಸೇನಾ ಮುಖ್ಯಸ್ಥ ಜನರಲ್ ಸುಂದರರಾಜನ್ ಪದ್ಮನಾಭನ್ ನಿಧನ,"ಸೇನಾ ವಲಯಗಳಲ್ಲಿ ಭತ್ತ ಎಂದು ಪ್ರೀತಿಯಿಂದ ಕರೆಯಲ್ಪಡುವ ಮಾಜಿ ಸೇನಾ ಸಿಬ್ಬಂದಿ ಜನರಲ್ ಸುಂದರರಾಜನ್ ಪದ್ಮನಾಭನ್ ಅವರು ಇಲ್ಲಿನ ನಿವಾಸದಲ್ಲಿ ವೃದ್ಧಾಪ್ಯದಿಂದಾಗಿ ನಿಧನರಾದರು ಎಂದು ಅವರಿಗೆ ಹತ್ತಿರವಿರುವ ಮೂಲವೊಂದು ಸೋಮವಾರ ತಿಳಿಸಿದೆ.ಅವರ ವಯಸ್ಸು 83. ಅವರು ಸೆಪ್ಟೆಂಬರ್ 30, 2000 ರಿಂದ ಡಿಸೆಂಬರ್ 31, 2002 ರಿಂದ 31 ರವರೆಗೆ ಸೇನಾ ಸಿಬ್ಬಂದಿಯಾಗಿ ಸೇವೆ ಸಲ್ಲಿಸಿದರು. ಜನರಲ್ ಪದ್ಮನಾಭನ್ ಅವರು ಪತ್ನಿ, ಮಗಳು ಮತ್ತು ಮಗರಿಂದ ಉಳಿದುಕೊಂಡಿದ್ದಾರೆ.","ಚೆನ್ನೈ: ಮಾಜಿ ಸೇನಾ ಮುಖ್ಯಸ್ಥ ಜನರಲ್ ಸುಂದರರಾಜನ್ ಪದ್ಮನಾಭನ್ ನಿಧನರಾಗಿದ್ದಾರೆ.  ವಯೋಸಹಜ ಕಾರಣದಿಂದ ಬಳಲುತ್ತಿದ್ದ ಅವರು ಚೆನ್ನೈನ  ನಿವಾಸದಲ್ಲಿ ಕೊನೆಯುಸಿರೆಳೆದಿದ್ದಾರೆ ಎಂದು ಅವರ ಆಪ್ತ  ಮೂಲಗಳು ಸೋಮವಾರ ತಿಳಿಸಿವೆ. ಅವರಿಗೆ 83 ವರ್ಷ ವಯಸ್ಸಾಗಿತ್ತು.  ಅವರು ಸೆಪ್ಟೆಂಬರ್ 30, 2000 ರಿಂದ 31 ಡಿಸೆಂಬರ್ 31, 2002 ರವರೆಗೆ ಸೇನಾ ಮುಖ್ಯಸ್ಥರಾಗಿ ಸೇವೆ ಸಲ್ಲಿಸಿದರು. ಜನರಲ್ ಪದ್ಮನಾಭನ್ ಅವರು ಪತ್ನಿ, ಪುತ್ರಿ ಮತ್ತು ಒಬ್ಬ ಮಗನನ್ನು ಅಗಲಿದ್ದಾರೆ.ಪದ್ಮನಾಭನ್ ಅವರ ಮಕ್ಕಳು ಇಂದು ರಾತ್ರಿ ಅಮೆರಿಕದಿಂದ ಆಗಮಿಸಲಿದ್ದು, ನಾಳೆ ಸಂಜೆ ಅಂತ್ಯಕ್ರಿಯೆ ನಡೆಯಲಿದೆ. 15 ಕಾರ್ಪ್ಸ್ ಕಮಾಂಡರ್ ಆಗಿ ಅವರ ಸೇವೆಯನ್ನು ಗುರುತಿಸಿ ಅತಿ ವಿಶಿಷ್ಟ ಸೇವಾ ಪದಕ ನೀಡಿ ಗೌರವಿಸಲಾಗಿತ್ತು..ಡಿಸೆಂಬರ್ 5, 1940 ರಂದು ಕೇರಳದ ತಿರುವನಂತಪುರದಲ್ಲಿ ಜನಿಸಿದ ಜನರಲ್ ಪದ್ಮನಾಭನ್ ಅವರು ಡೆಹ್ರಡೂನ್ ನ ಪ್ರತಿಷ್ಠಿತ ರಾಷ್ಟ್ರೀಯ ಭಾರತೀಯ ಮಿಲಿಟರಿ ಕಾಲೇಜು ಮತ್ತು ಪುಣೆ ಖಡಕವಾಸ್ಲಾದ ರಾಷ್ಟ್ರೀಯ ರಕ್ಷಣಾ ಅಕಾಡೆಮಿಯ ಹಳೆಯ ವಿದ್ಯಾರ್ಥಿಯಾಗಿದ್ದರು. ಅವರ ವೃತ್ತಿಜೀವನದಲ್ಲಿ  ಹಲವಾರು ಪ್ರತಿಷ್ಠಿತ ಕಮಾಂಡ್, ಸಿಬ್ಬಂದಿ ಮತ್ತು ನಿರ್ದೇಶನಾತ್ಮಾಕ ಹುದ್ದೆಗಳ ಜೊತೆಗೆ ಹಲವಾರು ಕಾರ್ಯಾಚರಣೆಗಳಲ್ಲಿ ಭಾಗವಹಿಸಿದ್ದರು ಎಂದು ರಕ್ಷಣಾ ಸಚಿವಾಲಯ ಪ್ರಕಟಣೆ ತಿಳಿಸಿದೆ..ಚೆನ್ನೈ: ಭಾರತೀಯ ಕೋಸ್ಟ್ ಗಾರ್ಡ್ ಮುಖ್ಯಸ್ಥ ರಾಕೇಶ್ ಪಾಲ್ ಹೃದಯಾಘಾತದಿಂದ ನಿಧನ.ಸುಂದರರಾಜನ್ ಪದ್ಮನಾಭನ್ ಅವರ ಪಾರ್ಥಿವ ಶರೀರಕ್ಕೆ ತಮಿಳುನಾಡು ಮುಖ್ಯಮಂತ್ರಿ ಆರ್ ಎನ್ ರವಿ ಅಂತಿಮ ನಮನ ಸಲ್ಲಿಸಿದ್ದು, ತಮಿಳುನಾಡು ಮುಖ್ಯಮಂತ್ರಿ ಎಂಕೆ ಸ್ಟಾಲಿನ್ ತೀವ್ರ  ಸಂತಾಪ ಸೂಚಿಸಿದ್ದಾರೆ..Follow KannadaPrabha channel on WhatsApp  KannadaPrabha News app ಡೌನ್‌ಲೋಡ್ ಮಾಡಿ, ಇತ್ತೀಚಿನ ಸುದ್ದಿಗಳ ಅಪ್ಡೇಟ್ಸ್ ಪಡೆಯಿರಿ"
ವಯನಾಡ್ ಭೂಕುಸಿತ ಸಂತ್ರಸ್ತರ ಖಾತೆಯಿಂದ ಇಎಂಐ ಕಡಿತ: ಮರುಪಾವತಿಗೆ ಜಿಲ್ಲಾಧಿಕಾರಿ ಆದೇಶ,"ಚೌರಾಮಾಲಾ ಶಾಖೆಯ ಅನೇಕ ಸಾಲಗಾರರ ಶವಗಳನ್ನು ವಶಪಡಿಸಿಕೊಳ್ಳಲಾಗಿದ್ದರೂ, ಸುಮಾರು 20 ಜನರು ಕಾಣೆಯಾಗಿದೆ ಎಂದು ವರದಿಯಾಗಿದೆ.","ಕಲ್ಪೆಟ್ಟ: ವಯನಾಡ್ ಭೂಕುಸಿತದ ಸಂತ್ರಸ್ತರ ಖಾತೆಯಿಂದ EMI ಕಡಿತಗೊಂಡಿರುವುದರ ಬಗ್ಗೆ ದೂರು ಬಂದ ಹಿನ್ನೆಲೆಯಲ್ಲಿ, ಸಂತ್ರಸ್ತರ ಖಾತೆಗೆ ಹಣ ಮರುಪಾವತಿ ಮಾಡುವಂತೆ ಜಿಲ್ಲಾಧಿಕಾರಿಗಳು ಬ್ಯಾಂಕ್ ಗಳಿಗೆ ಸೂಚನೆ ನೀಡಿದ್ದಾರೆ.ಭೂಕುಸಿತದ ಅನಾಹುತ ಸಂಭವಿಸಿದ ಬಳಿಕ ಪರಿಹಾರ ಶಿಬಿರಗಳಲ್ಲಿ ಇರುವ ಪ್ರತಿ ಕುಟುಂಬಕ್ಕೆ 10,000 ರೂಪಾಯಿಗಳ ಪರಿಹಾರ ಘೋಷಿಸಲಾಗಿತ್ತು. ಆದರೆ ಬ್ಯಾಂಕ್ ಖಾತೆಗಳಿಗೆ ಹಣ ಜಮಾ ಆದ ಬೆನ್ನಲ್ಲೇ ಬ್ಯಾಂಕ್ ಗಳು EMI ಕಡಿತಗೊಳಿಸಿವೆ ಎಂದು ಜಿಲ್ಲಾಧಿಕಾರಿಗಳಿಗೆ ದೂರು ನೀಡಲಾಗಿತ್ತು.ಪರಿಹಾರ ಹಣ ಇಎಂಐ ಪಾವತಿ ಮಾಡುವುದಕ್ಕೆ ಅಲ್ಲ ಎಂದು ವಯನಾಡ್ ಕಲೆಕ್ಟರ್ ಮೇಘಶ್ರೀ ಡಿ ಆರ್ ಸ್ಪಷ್ಟಪಡಿಸಿದ್ದಾರೆ. .ಕೇರಳ ರಾಜ್ಯ ಸಹಕಾರಿ ಬ್ಯಾಂಕ್‌ (ಕೇರಳ ಬ್ಯಾಂಕ್) ಚೂರಲ್‌ಮಲಾ ಶಾಖೆಯು ಮುಂಡಕ್ಕೈ, ಪುಂಚಿರಿಮಟ್ಟಂ ಮತ್ತು ಚೂರಲ್‌ಮಲಾ ವಿಪತ್ತು ಪೀಡಿತ ಪ್ರದೇಶಗಳಿಂದ 213 ಸಾಲಗಾರರನ್ನು ಹೊಂದಿದ್ದು, ಅವರಿಗೆ 6.63 ಕೋಟಿ ರೂಪಾಯಿಗಳ ಸಾಲವನ್ನು ವಿತರಿಸಿದೆ. ಅಲ್ಲದೆ, ಗ್ರಾಮಸ್ಥರ ಹೆಸರಿನಲ್ಲಿ 400ಕ್ಕೂ ಹೆಚ್ಚು ಚಿನ್ನದ ಸಾಲಗಳಿವೆ. ಚೂರಲ್ಮಲಾ ಶಾಖೆಯ ಅನೇಕ ಸಾಲಗಾರರ ಮೃತದೇಹಗಳು ಪತ್ತೆಯಾಗಿದ್ದು, ನಾಪತ್ತೆಯಾದವರಲ್ಲಿ ಸುಮಾರು 20 ಜನರು ಸೇರಿದ್ದಾರೆ.ಭೂಕುಸಿತದಲ್ಲಿ ಮೃತಪಟ್ಟವರ ಮತ್ತು ಮನೆ, ಭೂಮಿ ಕಳೆದುಕೊಂಡವರ ಸಾಲ ಮನ್ನಾ ಮಾಡಲು ಕೇರಳ ಬ್ಯಾಂಕ್ ನಿರ್ದೇಶಕ ಮಂಡಳಿ ನಿರ್ಧರಿಸಿತ್ತು. ಅಂತೆಯೇ, ರಾಜ್ಯ ಮಟ್ಟದ ಬ್ಯಾಂಕರ್‌ಗಳ ಸಮಿತಿಯು ವಯನಾಡ್ ದುರಂತ ಸಂತ್ರಸ್ತರು ಬ್ಯಾಂಕ್ ಸಾಲವನ್ನು ಮರುಪಾವತಿಸಬೇಕಾಗಿಲ್ಲ ಎಂದು ಸರ್ಕಾರಕ್ಕೆ ಭರವಸೆ ನೀಡಿತ್ತು..ಹವಾಮಾನ ಬದಲಾವಣೆ, ಶೇ.10ರಷ್ಟು ಅಧಿಕ ಮಳೆ ವಯನಾಡ್ ಭೂಕುಸಿತಕ್ಕೆ ಕಾರಣ: WWA.“ಎರಡು ವರ್ಷಗಳ ಹಿಂದೆ ನಾನು ಹಸುಗಳನ್ನು ಖರೀದಿಸಲು ಕೇರಳ ಬ್ಯಾಂಕ್‌ನಿಂದ ಸಾಲ ಪಡೆದಿದ್ದೆ. ಭೂಕುಸಿತದಲ್ಲಿ ನನ್ನ ಮನೆ, ಹಸುಗಳು ಕೊಚ್ಚಿ ಹೋಗಿವೆ. ಸರಕಾರದಿಂದ ಬಂದ ತಕ್ಷಣದ ಪರಿಹಾರ ನಿಧಿ ನನ್ನ ಖಾತೆಗೆ ಜಮಾ ಆದ ನಂತರ ಬ್ಯಾಂಕ್‌ನಿಂದ ಆಗಸ್ಟ್ 15ರಂದು 5 ಸಾವಿರ ರೂ. ಇಎಂಐ ಕಡಿತಗೊಂಡಿದೆ ಎಂದು ಮುಂಡಕ್ಕೈ ನಿವಾಸಿ ರಾಜೇಶ್ ಹೇಳಿದ್ದಾರೆ. ಈ ಬಗ್ಗೆ ದೂರುಗಳು ಬಂದ ಹಿನ್ನೆಲೆಯಲ್ಲಿ ಮುಖ್ಯಮಂತ್ರಿ ಪಿಣರಾಯಿ ವಿಜಯನ್ ಅವರು ಮಧ್ಯಪ್ರವೇಶಿಸಿ ಅಗತ್ಯ ಕ್ರಮ ಕೈಗೊಳ್ಳುವಂತೆ ಜಿಲ್ಲಾಧಿಕಾರಿಗಳಿಗೆ ಸೂಚಿಸಿದರು.ಕಡಿತಗೊಳಿಸಿದ ಮೊತ್ತವನ್ನು ಮರುಪಾವತಿ ಮಾಡಲಾಗುವುದು ಎಂದು ಕೇರಳ ಬ್ಯಾಂಕ್ ಅಧ್ಯಕ್ಷ ವಿ ರವೀಂದ್ರನ್ ಹೇಳಿದ್ದಾರೆ..Follow KannadaPrabha channel on WhatsApp  KannadaPrabha News app ಡೌನ್‌ಲೋಡ್ ಮಾಡಿ, ಇತ್ತೀಚಿನ ಸುದ್ದಿಗಳ ಅಪ್ಡೇಟ್ಸ್ ಪಡೆಯಿರಿ"
ಅತ್ಯಪರೂಪದ ''Super Blue Moon ''; ಆಕಾಶದಲ್ಲಿನ ಪವಾಡಕ್ಕೆ ಕ್ಷಣಗಣನೆ,ಆಗಸ್ಟ್ 19 ರಂದು ಸ್ಕೈಗೇಜರ್‌ಗಳು ಒಂದು ಸತ್ಕಾರಕ್ಕೆ ಇರುತ್ತಾರೆ ಏಕೆಂದರೆ ಅವರು 2024 ರ ಅತಿದೊಡ್ಡ ಮತ್ತು ಪ್ರಕಾಶಮಾನವಾದ ಚಂದ್ರಗಳಲ್ಲಿ ಒಂದಾದ ಸೂಪರ್‌ಮೂನ್ ಅನ್ನು ನೋಡುತ್ತಾರೆ.,"ನವದೆಹಲಿ: ಇಂದು ರಾಖಿ ಹುಣ್ಣಿಮೆಯಂದು ಆಕಾಶದಲ್ಲಿ ಅಪರೂಪದ ದೃಶ್ಯ ಕಾಣಿಸಲಿದ್ದು, ''ಸೂಪರ್ ಬ್ಲೂ ಮೂನ್''ಗೆ ಕ್ಷಣಗಣನೆ ಆರಂಭವಾಗಿದೆ.ಈ ಬಾರಿ ಆಗಸ್ಟ್ 19ರ ರಾಖಿ ಹುಣ್ಣಿಮೆಯಂದು ಆಕಾಶದಲ್ಲಿ ನೀಲಿ ಚಂದ್ರ ನೋಡಲು ಕಾಣಸಿಗಲಿದ್ದಾನೆ. ಸೂಪರ್‌ಮೂನ್‌ಗಳು ಸಾಮಾನ್ಯವಾಗಿ ವರ್ಷಕ್ಕೆ 3-4 ಬಾರಿ ಸಂಭವಿಸುತ್ತವೆ.ಈ ತಿಂಗಳು, ಸೂಪರ್ ಮೂನ್ ಮತ್ತು ಬ್ಲೂ ಮೂನ್ ಒಂದುಗೂಡುವ ಅಪರೂಪದ ಖಗೋಳ ಘಟನೆಯನ್ನು ನಾವು ವೀಕ್ಷಿಸಬಹುದು. ಈ ಅಪರೂಪದ ಖಗೋಳ ವಿದ್ಯಮಾನವನ್ನು ಹಲವು ವರ್ಷಗಳಿಗೊಮ್ಮೆ ಮಾತ್ರ ಕಾಣಬಹುದು ಎಂದು ವಿಜ್ಞಾನಿಗಳು ಹೇಳಿದ್ದಾರೆ. ಸಾಮಾನ್ಯವಾಗಿ, ಆಗಸ್ಟ್‌ನಲ್ಲಿ ಬರುವ ಹುಣ್ಣಿಮೆಯನ್ನು ’ಸ್ಟರ್ಜನ್ ಮೂನ್ ಎಂದು ಕರೆಯಲಾಗುತ್ತದೆ. ಸೂಪರ್ ಬ್ಲೂ ಮೂನ್ ಆಗಸ್ಟ್‌ನಲ್ಲಿ ಕಾಣಿಸಿಕೊಳ್ಳುವುದರಿಂದ ಇದನ್ನು 'ಸ್ಟರ್ಜನ್ ಮೂನ್ ಎಂದೂ ಕರೆಯಲಾಗುತ್ತದೆ..ಆಗಸದಲ್ಲಿ ಕಂಡ ಬ್ಲಡ್ ಮೂನ್ ಅಪರೂಪದ ಚಿತ್ರಗಳು.ಯಾವಾಗ ಸಂಭವಿಸುತ್ತದೆ ''ಸೂಪರ್ ಬ್ಲೂ ಮೂನ್''?ಭಾರತದ ಕಾಲಮಾನದ ಪ್ರಕಾರ ಆಗಸ್ಟ್ 19 ಅಂದರೆ ಇಂದು ರಾತ್ರಿ 11-56ಕ್ಕೆ ಚಂದ್ರನು ಸಾಮಾನ್ಯ ದಿನಗಳಿಗಿಂತ 30 ಪ್ರತಿಶತದಷ್ಟು ಪ್ರಕಾಶಮಾನವಾಗಿ ಮತ್ತು 14 ಪ್ರತಿಶತದಷ್ಟು ದೊಡ್ಡದಾಗಿ ಕಾಣಿಸುತ್ತಾನೆ. ಈ ವರ್ಷದ 4 ಸೂಪರ್ ಮೂನ್‌ಗಳಲ್ಲಿ ಇದು ಮೊದಲನೆಯದಾಗಿದೆ.ಇನ್ನುಳಿದ ಮೂರು ಮುಂಬರುವ ಸೆಪ್ಟೆಂಬರ್ 17, ಅಕ್ಟೋಬರ್ 17 ಮತ್ತು ನವೆಂಬರ್ 15 ರಂದು ಕಾಣಿಸಲಿದೆ ಎಂದು ಹೇಳಲಾಗಿದೆ. ಚಂದ್ರನು ಭೂಮಿಗೆ ಹತ್ತಿರ ಬಂದಾಗ ಈ ಸೂಪರ್ ಮೂನ್‌ಗಳು ರೂಪುಗೊಳ್ಳುತ್ತವೆ. ಚಂದ್ರನು ಭೂಮಿಗೆ 90 ಪ್ರತಿಶತದಷ್ಟು ಹತ್ತಿರ ಬಂದಾಗ ಸೂಪರ್ ಮೂನ್ ಸಂಭವಿಸುತ್ತದೆ. ಸೂಪರ್‌ಮೂನ್ ಎಂಬ ಪದವನ್ನು ಖಗೋಳಶಾಸ್ತ್ರಜ್ಞ ರಿಚರ್ಡ್ ನೊಲ್ಲೆ ಅವರು 1979 ರಲ್ಲಿ ಸೃಷ್ಟಿಸಿದ್ದರು..ಈ ಸೂಪರ್ ಬ್ಲೂ ಮೂನ್ ಎಲ್ಲರಿಗೂ ಕಾಣಲಿದ್ದು, ವಾಯುಮಾಲಿನ್ಯವಿಲ್ಲದ ಪ್ರದೇಶಗಳಲ್ಲಿ ಇದು ಹೆಚ್ಚು ಸ್ಪಷ್ಟವಾಗಿದೆ ಕಾಣಲಿದೆ. ಸೂಪರ್ ಮೂನ್ ನಾವು ನಮ್ಮ ಬರಿ ಕಣ್ಣುಗಳಿಂದ ನೋಡಬಹುದಾದರೂ, ಬೈನಾಕ್ಯುಲರ್ ಅಥವಾ ದೂರದರ್ಶಕವನ್ನು ಬಳಸಿಕೊಂಡು ನಾವು ಅದನ್ನು ಹೆಚ್ಚು ಸ್ಪಷ್ಟವಾಗಿ ನೋಡಬಹುದು. ಈ ಸೂಪರ್ ಮೂನ್ ಕಣ್ಣಿಗೆ ಹಾನಿಯಾಗದ ರೀತಿಯಲ್ಲಿ ನೋಡಲು ವಿಜ್ಞಾನಿಗಳು ಸೂಚಿಸಿದ್ದು, ಈ ಸೂಪರ್ ಬ್ಲೂ ಮೂನ್ ನೋಡಲು ಪ್ರಪಂಚದಾದ್ಯಂತ ಜನರು ಕಾತರದಿಂದ ಕಾಯುತ್ತಿದ್ದಾರೆ..Follow KannadaPrabha channel on WhatsApp  KannadaPrabha News app ಡೌನ್‌ಲೋಡ್ ಮಾಡಿ, ಇತ್ತೀಚಿನ ಸುದ್ದಿಗಳ ಅಪ್ಡೇಟ್ಸ್ ಪಡೆಯಿರಿ"
"VIDEO: ಸ್ನೇಹಿತನೊಂದಿಗೆ ಮಾತನಾಡುತ್ತಿದ್ದಾಗಲೇ ತಲೆ ಮೇಲೆ AC ಬಿದ್ದು ಯುವಕ ಸಾವು, ಮತ್ತೋರ್ವ ಗಂಭೀರ","ಸಿಸಿಟಿವಿ ತುಣುಕಿನಲ್ಲಿ, 18 ವರ್ಷದ ಜಿತೇಶ್ ತನ್ನ ಸ್ಕೂಟರ್ ಮೇಲೆ ಕುಳಿತುಕೊಳ್ಳುವುದನ್ನು ಕಾಣಬಹುದು, ಅವನು ಇನ್ನೊಬ್ಬ ಹುಡುಗ ಪ್ರಿನ್ಶು, 17 ರೊಂದಿಗೆ ಚಾಟ್ ಮಾಡುತ್ತಿರುವಾಗ ಹೊರಹೋಗಲು ಸಿದ್ಧನಾಗಿರುತ್ತಾನೆ. ಇಬ್ಬರೂ ತಬ್ಬಿಕೊಳ್ಳುತ್ತಿದ್ದಂತೆ, ಕಿಟಕಿ ಎಸಿ ಜಿತೇಶನ ತಲೆಯ ಮೇಲೆ ಬೀಳುತ್ತದೆಎರಡನೇ ಮಹಡಿಯಿಂದ.","ನವದೆಹಲಿ: ಸಾವು ಹೇಗೆಲ್ಲಾ ಬರುತ್ತದೆ ತಿಳಿಯುವುದೇ ಇಲ್ಲ.. ಇದೀಗ ಅಂತಹುದೇ ಮತ್ತೊಂದು ಪ್ರಕರಣ ದೆಹಲಿಯಲ್ಲಿ ವರದಿಯಾಗಿದ್ದು, ಸ್ನೇಹಿತನೊಂದಿಗೆ ಮಾತನಾಡುತ್ತಿದ್ದಾಗಲೇ ತಲೆ ಮೇಲೆ ಎಸಿ ಬಿದ್ದ ಪರಿಣಾಮ ಯುವಕ ಸ್ಥಳದಲ್ಲೇ ಸಾವನ್ನಪ್ಪಿರುವ ಘಟನೆ ವರದಿಯಾಗಿದೆ.ದೆಹಲಿಯ ಡಿಬಿಜಿ ರೋಡ್ ನಲ್ಲಿ ಈ ಘಟನೆ ನಡೆದಿದ್ದು, ಆಗಷ್ಟೇ ದ್ವಿಚಕ್ರವಾಹನದಲ್ಲಿ ಬಂದ ಯುವಕ ತನ್ನ ಸ್ಥೇಹಿತನೊಂದಿಗೆ ಮಾತನಾಡುತ್ತಿದ್ದ ವೇಳೆ ಮೇಲೆ ಅಳವಡಿಸಲಾಗಿದ್ದ ಎಸಿ ಉರುಳಿ ಆತನ ತಲೆ ಮೇಲೆ ಬಿದ್ದಿದೆ. ಎಸಿ ಬಿದ್ದ ರಭಸಕ್ಕೆ ವ್ಯಕ್ತಿ ಸ್ಥಳದಲ್ಲೇ ಸಾವನ್ನಪ್ಪಿದ್ದು, ಆತನೊಂದಿಗೆ ಮಾತನಾಡುತ್ತಿದ್ದ ಮತ್ತೋರ್ವ ಸ್ನೇಹಿತನಿಗೂ ಗಂಭೀರ ಗಾಯವಾಗಿದೆ. ಕೂಡಲೇ ಇಬ್ಬರನ್ನು ಆಸ್ಪತ್ರೆಗೆ ದಾಖಲಿಸಲಾಯಿತಾದರೂ ಈ ಪೈಕಿ ಎಸಿ ತಲೆ ಮೇಲೆ ಬಿದ್ದ ವ್ಯಕ್ತಿ ಸಾವನ್ನಪ್ಪಿದ್ದಾನೆ ಎಂದು ಅಧಿಕಾರಿಗಳು ತಿಳಿಸಿದ್ದಾರೆ..ಆ್ಯಕ್ಸಿಡೆಂಟ್ ಹಾಟ್ ಸ್ಪಾಟ್ ಆಗುತ್ತಿದೇ ಉಡುಪಿ NH 66, 2023ರಲ್ಲಿ 222 ಮಂದಿ ಸಾವು.ಮತ್ತೋರ್ವ ಪ್ರಾಂಶು ಎಂಬಾತನ ಸ್ಥಿತಿ ಗಂಭೀರವಾಗಿದ್ದು, ಆತನಿಗೆ ಎಲ್ಲ ಅಗತ್ಯ ಚಿಕಿತ್ಸೆ ನೀಡಲಾಗುತ್ತಿದೆ ಎಂದು ವೈದ್ಯರು ಹೇಳಿದ್ದಾರೆ. ಅಂತೆಯೇ ಮೃತ ವ್ಯಕ್ತಿಯ ಪತ್ತೆಯಾಗಿದ್ದು, ಆತನನ್ನು 18 ವರ್ಷದ ದೆಹಲಿ ನಿವಾಸಿ ಜಿತೇಶ್ ಎಂದು ಅಧಿಕಾರಿಗಳು ತಿಳಿಸಿದ್ದಾರೆ.ಪ್ರಕರಣ ದಾಖಲಿಸಿಕೊಂಡಿರುವ ಪೊಲೀಸರು ತನಿಖೆ ನಡೆಸಿದ್ದಾರೆ..Follow KannadaPrabha channel on WhatsApp  KannadaPrabha News app ಡೌನ್‌ಲೋಡ್ ಮಾಡಿ, ಇತ್ತೀಚಿನ ಸುದ್ದಿಗಳ ಅಪ್ಡೇಟ್ಸ್ ಪಡೆಯಿರಿ"
ಜಮ್ಮು-ಕಾಶ್ಮೀರ: ಉಗ್ರರ ದಾಳಿಯಲ್ಲಿ CRPF ಇನ್ಸ್ ಪೆಕ್ಟರ್ ಹುತಾತ್ಮ!,ಜಮ್ಮು ಮತ್ತು ಕಾಶ್ಮೀರದ ಉಧಾಂಪುರ ಜಿಲ್ಲೆಯ ಗಸ್ತು ಪಕ್ಷಕ್ಕೆ ಭಯೋತ್ಪಾದಕರು ಗುಂಡು ಹಾರಿಸಿದಾಗ ಕೇಂದ್ರ ರಿಸರ್ವ್ ಪೊಲೀಸ್ ಪಡೆ (ಸಿಆರ್ಪಿಎಫ್) ಇನ್ಸ್‌ಪೆಕ್ಟರ್ ಸಾವನ್ನಪ್ಪಿದ್ದಾರೆ ಎಂದು ಅಧಿಕಾರಿಗಳು ತಿಳಿಸಿದ್ದಾರೆ.,"ಉದ್ದಂಪುರ: ಕೇಂದ್ರಾಡಳಿತ ಪ್ರದೇಶ ಜಮ್ಮು-ಕಾಶ್ಮೀರದಲ್ಲಿ ಇತ್ತೀಚಿಗೆ ಉಗ್ರರ ಒಳನುಸುಳುವಿಕೆ ಪ್ರಕರಣ ಹೆಚ್ಚಾಗುತ್ತಿದ್ದು, ಸೋಮವಾರ ಉಗ್ರರ ದಾಳಿಯಲ್ಲಿ ಓರ್ವ ಸಿಆರ್ ಪಿಎಫ್ ಇನ್ಸ್ ಪೆಕ್ಟರ್ ಹುತಾತ್ಮರಾಗಿದ್ದಾರೆ. ಉದ್ದಂಪುರ ಜಿಲ್ಲೆಯಲ್ಲಿ ಗಸ್ತು ಪಡೆಯ ಮೇಲೆ ಉಗ್ರರು ಗುಂಡಿನ ದಾಳಿ ನಡೆಸಿದ್ದರಿಂದ ಕೇಂದ್ರೀಯ ಮೀಸಲು ಪೊಲೀಸ್ ಪಡೆ (ಸಿಆರ್‌ಪಿಎಫ್) ಇನ್ಸ್‌ಪೆಕ್ಟರ್ ಹುತಾತ್ಮರಾಗಿದ್ದಾರ ಎಂದು ಅಧಿಕಾರಿಗಳು ತಿಳಿಸಿದ್ದಾರೆ..ಬಸಂತ್‌ಗಢದ  ದುಡು ಪ್ರದೇಶದಲ್ಲಿ ಮಧ್ಯಾಹ್ನ 3:30 ರ ಸುಮಾರಿನಲ್ಲಿ ಸಿಆರ್‌ಪಿಎಫ್ ಮತ್ತು ಸ್ಥಳೀಯ ಪೊಲೀಸರ ವಿಶೇಷ ಕಾರ್ಯಾಚರಣೆ ಗುಂಪಿನ ಮೇಲೆ ಉಗ್ರರು ಗುಂಡು ಹಾರಿಸಿದ್ದಾರೆ. ಇದರಿಂದ 187ನೇ ಬೆಟಾಲಿಯನ್‌ಗೆ ಸೇರಿದ ಸಿಆರ್‌ಪಿಎಫ್‌ನ ಇನ್ಸ್‌ಪೆಕ್ಟರ್‌ಗೆ ಗುಂಡು ತಗುಲಿದೆ. ಗುಂಡೇಟಿನಿಂದ ಗಂಭೀರವಾಗಿ ಗಾಯಗೊಂಡಿದ್ದ ಅವರನ್ನು ಆಸ್ಪತ್ರೆಗೆ ಕರೆದೊಯ್ಯುವಾಗ ಹುತಾತ್ಮರಾಗಿದ್ದಾರೆ ಎಂದು ಅವರು ಮಾಹಿತಿ ನೀಡಿದ್ದಾರೆ. .ಜಮ್ಮು ಕಾಶ್ಮೀರ: ದೋಡಾದಲ್ಲಿ ಉಗ್ರರು-ಸೇನಾಪಡೆ ನಡುವೆ ಭಾರೀ ಗುಂಡಿನ ಚಕಮಕಿ: ಓರ್ವ ಸೇನಾಧಿಕಾರಿ ಸೇರಿ ನಾಲ್ವರು ಯೋಧರು ಹುತಾತ್ಮ.ಜಂಟಿ ಗಸ್ತು ತಂಡ ಬಲವಾದ ಪ್ರತೀಕಾರದ ಮೂಲಕ ಉಗ್ರರು ಸ್ಥಳದಿಂದ ಪರಾರಿಯಾಗಿದ್ದಾರೆ. ಮತ್ತಷ್ಟು ಸೇನೆ ಸ್ಥಳಕ್ಕೆ ಧಾವಿಸಿದ್ದು, ಉಗ್ರರನ್ನು ಪತ್ತೆ ಹಚ್ಚಿ, ಹೊಡೆದುರುಳಿಸಲು ಶೋಧ ಕಾರ್ಯಾಚರಣೆ ಪ್ರಾರಂಭಿಸಲಾಗಿದೆ ಎಂದು ಅಧಿಕಾರಿಗಳು ತಿಳಿಸಿದ್ದಾರೆ..Follow KannadaPrabha channel on WhatsApp  KannadaPrabha News app ಡೌನ್‌ಲೋಡ್ ಮಾಡಿ, ಇತ್ತೀಚಿನ ಸುದ್ದಿಗಳ ಅಪ್ಡೇಟ್ಸ್ ಪಡೆಯಿರಿ"
