title,summary,full_text
ಸೆಪ್ಟೆಂಬರ್ ನಲ್ಲಿ ಜಪಾನ್ ಪ್ರಧಾನಿ ಕಿಶಿದಾ ರಾಜೀನಾಮೆ; ಮರು ಚುನಾವಣೆ ಬಯಸದಿರಲು ನಿರ್ಧಾರ,ಫ್ಯೂಮಿಯೊ ಕಿಶಿಡಾ ಅವರ ತ್ಯಜಿಸುವ ನಿರ್ಧಾರವು ಅವರನ್ನು ಲಿಬರಲ್ ಡೆಮಾಕ್ರಟಿಕ್ ಪಕ್ಷದ ಮುಖ್ಯಸ್ಥರನ್ನಾಗಿ ಮತ್ತು ವಿಸ್ತರಣೆಯ ಮೂಲಕ ವಿಶ್ವದ ನಾಲ್ಕನೇ ಅತಿದೊಡ್ಡ ಆರ್ಥಿಕತೆಯ ನಾಯಕರಾಗಿ ಬದಲಿಸಲು ಸ್ಪರ್ಧೆಯನ್ನು ಪ್ರಚೋದಿಸುತ್ತದೆ.,"ಟೋಕಿಯೋ: ಜಪಾನ್ ಪ್ರಧಾನಿ ಫುಮಿಯೋ ಕಿಶಿದಾ ತಮ್ಮ ಸ್ಥಾನಕ್ಕೆ ಸೆಪ್ಟೆಂಬರ್ ನಲ್ಲಿ ರಾಜೀನಾಮೆ ನೀಡಲಿದ್ದಾರೆ. ಹಗರಣಗಳು ಹಾಗೂ ಬೆಲೆ ಏರಿಕೆಯ ನಡುವೆ ಪ್ರಧಾನಿ ಹುದ್ದೆಯಲ್ಲಿ ಕಿಶಿದಾ 3 ವರ್ಷಗಳ ಕಾಲ ಪ್ರಧಾನಿಯಾಗಿದ್ದಾರೆ. ಕಿಶಿದಾಗೆ ಸಾರ್ವಜನಿಕ ಬೆಂಬಲ ಕ್ಷೀಣಿಸುತ್ತಿದ್ದು, ಮರು ಚುನಾವಣೆ ಬಯಸದಿರಲು ಲಿಬರಲ್ ಡೆಮಾಕ್ರೆಟಿಕ್ ಪಕ್ಷದ ನಾಯಕ ನಿರ್ಧರಿಸಿದ್ದಾರೆ ಎಂದು ಸಾರ್ವಜನಿಕ ಪ್ರಸಾರಕ NHK ಸೇರಿದಂತೆ ಜಪಾನಿನ ಮಾಧ್ಯಮವು ಹಿರಿಯ ಆಡಳಿತ ಸಿಬ್ಬಂದಿಯನ್ನು ಉಲ್ಲೇಖಿಸಿ ವರದಿ ಮಾಡಿದೆ..LDP ವಕ್ತಾರರು ಈ ವರದಿಯ ಬಗ್ಗೆ ಪ್ರತಿಕ್ರಿಯಿಸಲು ನಿರಾಕರಿಸಿದ್ದಾರೆ. ಕಿಶಿದಾ ಅವರು ಪದವಿ ತ್ಯಜಿಸುವ ನಿರ್ಧಾರ, ಪಕ್ಷದ ಮುಖ್ಯಸ್ಥರ ಸ್ಥಾನಕ್ಕೆ ಮತ್ತು ವಿಶ್ವದ ನಾಲ್ಕನೇ ಅತಿದೊಡ್ಡ ಆರ್ಥಿಕತೆಗೆ ಹೊಸ ನಾಯಕನ ಆಯ್ಕೆ ಮಾಡಲು ಸ್ಪರ್ಧೆಯನ್ನು ಉಂಟುಮಾಡಲಿದೆ..ಜಪಾನ್ ನಲ್ಲಿ Quad ಸಭೆ; ಪತ್ರಕರ್ತನಿಗೆ ಚಳಿ ಬಿಡಿಸಿದ ಎಸ್ ಜೈಶಂಕರ್!.LDP ಆಯ್ಕೆ ಮಾಡುವ ಕಿಶಿದಾ ಉತ್ತರಾಧಿಕಾರಿಗೆ ಜೀವನ ವೆಚ್ಚದಲ್ಲಿ ಹೆಚ್ಚಳ, ಭೌಗೋಳಿಕ ರಾಜಕೀಯ ಉದ್ವಿಗ್ನತೆಗಳು ಸವಾಲಿನ ಸಂಗತಿಯಾಗಿರಲಿದೆ..Follow KannadaPrabha channel on WhatsApp  KannadaPrabha News app ಡೌನ್‌ಲೋಡ್ ಮಾಡಿ, ಇತ್ತೀಚಿನ ಸುದ್ದಿಗಳ ಅಪ್ಡೇಟ್ಸ್ ಪಡೆಯಿರಿ"
ಬಾಂಗ್ಲಾದಲ್ಲಿ: ಪ್ರತಿಭಟನಾ ನಿರತರ ಹತ್ಯೆ; ಅಸ್ಥಿರ ರಾಷ್ಟ್ರಕ್ಕೆ ಭೇಟಿ ನೀಡಲಿರುವ ವಿಶ್ವಸಂಸ್ಥೆ ತಂಡ,ಕಳೆದ ವಾರ ಶೇಖ್ ಹಸೀನಾ ಪ್ರಧಾನ ಮಂತ್ರಿಯಾಗಿ ರಾಜೀನಾಮೆ ನೀಡಿದ ನಂತರ ಪ್ರತಿಭಟನಾಕಾರರ ಹತ್ಯೆಯ ಬಗ್ಗೆ ತನಿಖೆ ನಡೆಸಲು ವಿಶ್ವಸಂಸ್ಥೆಯ ತಜ್ಞರ ತಂಡವು ಮುಂದಿನ ವಾರ ಬಾಂಗ್ಲಾದೇಶಕ್ಕೆ ಭೇಟಿ ನೀಡಲಿದೆ ಎಂದು ಗುರುವಾರ ಪ್ರಕಟಿಸಲಾಗಿದೆ.,"ಬಾಂಗ್ಲಾದೇಶ: ವಿಶ್ವಸಂಸ್ಥೆಯ ತಂಡ ಬಾಂಗ್ಲಾದೇಶಕ್ಕೆ ಮುಂದಿನ ವಾರ ಭೇಟಿ ನೀಡಲಿದ್ದು, ಪ್ರತಿಭಟನಾ ನಿರತರ ಹತ್ಯೆಯ ಬಗ್ಗೆ ತನಿಖೆ ನಡೆಸಲಿದೆ. ಕಳೆದ ವಾರ ಶೇಖ್ ಹಸೀನಾ ಪ್ರಧಾನಿ ಸ್ಥಾನಕ್ಕೆ ರಾಜೀನಾಮೆ ಸಲ್ಲಿಸಿದ ಬಳಿಕ ನಡೆದಿದ್ದ ಹಿಂಸಾಚಾರದಲ್ಲಿ ಪ್ರತಿಭಟನಾ ನಿರತರನ್ನು ಹತ್ಯೆ ಮಾಡಲಾಗಿತ್ತು 1971 ರಲ್ಲಿ ಬಾಂಗ್ಲಾಗೆ ಸ್ವಾತಂತ್ರ್ಯ ದೊರೆತ ಬಳಿಕ ಇದೇ ಮೊದಲ ಬಾರಿಗೆ ವಿಶ್ವಸಂಸ್ಥೆ ತಂಡ ಬಾಂಗ್ಲಾದೇಶಕ್ಕೆ ಭೇಟಿ ನೀಡಲಿದ್ದು ಮಾನವ ಹಕ್ಕುಗಳ ಉಲ್ಲಂಘನೆಯ ಬಗ್ಗೆ ತನಿಖೆ ನಡೆಸಲಿದೆ. .ಬಾಂಗ್ಲಾದೇಶ: ಪಲಾಯನ ನಂತರ ಶೇಖ್ ಹಸೀನಾ ಮೊದಲ ಹೇಳಿಕೆ; ಮಾಜಿ ಪ್ರಧಾನಿ ಹೇಳಿದ್ದೇನು?.ಯುಎನ್ ತಂಡ ಭೇಟಿ ನೀಡುವುದರ ಬಗ್ಗೆ ಬಾಂಗ್ಲಾ ಸರ್ಕಾರಿ ಸಲಹೆಗಾರರೊಬ್ಬರು ಮಾಹಿತಿ ನೀಡಿದ್ದಾರೆ. ಮುಹಮ್ಮದ್ ಯೂನಸ್ ಅವರು ಆ.8 ರಂದು ಮಧ್ಯಂತರ ಸರ್ಕಾರದ ಮುಖ್ಯ ಸಲಹೆಗಾರರಾಗಿ ಪ್ರಮಾಣವಚನ ಸ್ವೀಕರಿಸಿದರು, ಶೇಖ್ ಹಸೀನಾ ಅವರ ಸರ್ಕಾರ ಪತನಗೊಂಡ ಕೆಲವು ದಿನಗಳ ನಂತರ ಮತ್ತು ಅವರು ಆಗಸ್ಟ್ 5 ರಂದು ಸರ್ಕಾರಿ ಉದ್ಯೋಗಗಳಿಗೆ ಕೋಟಾ ಸುಧಾರಣೆಗಳ ಮೇಲೆ ಹಿಂಸಾತ್ಮಕ ಪ್ರತಿಭಟನೆಗಳ ನಡುವೆ ದೇಶ ತೊರೆದು ಭಾರತದಲ್ಲಿ ಆಶ್ರಯ ಪಡೆದಿದ್ದಾರೆ..Follow KannadaPrabha channel on WhatsApp  KannadaPrabha News app ಡೌನ್‌ಲೋಡ್ ಮಾಡಿ, ಇತ್ತೀಚಿನ ಸುದ್ದಿಗಳ ಅಪ್ಡೇಟ್ಸ್ ಪಡೆಯಿರಿ"
"'ಸ್ಟೇಯಿನ್ ಅಲೈವ್' ಗೆ ಎಲೋನ್ ಮಸ್ಕ್, ಡೊನಾಲ್ಡ್ ಟ್ರಂಪ್ ಸ್ಟೆಪ್: AI ವಿಡಿಯೊ ಹೇಗಿದೆ ನೋಡಿ...",ನವೆಂಬರ್ 5 ರ ಯುಎಸ್ ಚುನಾವಣೆಯ ರಿಪಬ್ಲಿಕನ್ ನಾಮನಿರ್ದೇಶಿತ ಡೊನಾಲ್ಡ್ ಟ್ರಂಪ್ ಗುರುವಾರ (ಆಗಸ್ಟ್ 15) ಸ್ವತಃ ಮತ್ತು ಟೆಸ್ಲಾ ಬಾಸ್ ಎಲೋನ್ ಮಸ್ಕ್ ಅವರು ಅಪ್ರತಿಮ ಬೀ ಗೀಸ್ ಟ್ರ್ಯಾಕ್ ‘ಸ್ಟೇನ್ 'ಅಲೈವ್’ ಗೆ ಗ್ರೂವಿಂಗ್ ಮಾಡುವ ಎಐ-ರಚಿತ ವೀಡಿಯೊವನ್ನು ಹಂಚಿಕೊಂಡಿದ್ದಾರೆ.ಟ್ರಂಪ್ ಅವರು ಎಕ್ಸ್ (ಹಿಂದೆ ಟ್ವಿಟರ್) ನಲ್ಲಿ ತಮ್ಮ ಪೋಸ್ಟ್‌ಗೆ ಯಾವುದೇ ಶೀರ್ಷಿಕೆಯನ್ನು ಸೇರಿಸಲಿಲ್ಲ.,"ವಾಷಿಂಗ್ಟನ್: ನವೆಂಬರ್ 5 ರ ಅಮೆರಿಕ ಚುನಾವಣೆಗೆ ರಿಪಬ್ಲಿಕನ್ ಅಭ್ಯರ್ಥಿ ಡೊನಾಲ್ಡ್ ಟ್ರಂಪ್ ಅವರು  ಎಐಯಲ್ಲಿ ರಚಿತವಾದ ವೀಡಿಯೊವನ್ನು ಹಂಚಿಕೊಂಡಿದ್ದಾರೆ. ಟೆಸ್ಲಾ ಮುಖ್ಯಸ್ಥ ಎಲೋನ್ ಮಸ್ಕ್ ಅವರು ಐಕಾನಿಕ್ ಬೀ ಗೀಸ್ ಟ್ರ್ಯಾಕ್ 'ಸ್ಟೇಯಿನ್' ಅಲೈವ್'ಗೆ ಗ್ರೂವ್ ಮಾಡುತ್ತಿದ್ದಾರೆ. ಟ್ರಂಪ್ ಅವರು ಹಂಚಿಕೊಂಡಿರುವ ಎಕ್ಸ್ ಪೋಸ್ಟ್ ಗೆ ಯಾವುದೇ ಕಮೆಂಟ್ ಹಾಕಿಲ್ಲ. 36 ಸೆಕೆಂಡುಗಳ ವಿಡಿಯೊವು ಮಸ್ಕ್ ಮತ್ತು ಟ್ರಂಪ್ ಇಬ್ಬರೂ ಗರಿಗರಿಯಾದ ಸೂಟ್‌ಗಳನ್ನು ಧರಿಸಿ ಸಿಂಕ್ರೊನಿಸಿಟಿಯಲ್ಲಿ ಉತ್ಸಾಹಭರಿತ ನೃತ್ಯ ಮಾಡುತ್ತಿದ್ದಾರೆ. ಕ್ಲಿಪ್ ನ್ನು ಉತಾಹ್‌ನ ಯುಎಸ್ ಸೆನೆಟರ್ ಮೈಕ್ ಲೀ ಅವರು ಎಕ್ಸ್ ನಲ್ಲಿ ಮೊದಲು ಪೋಸ್ಟ್ ಮಾಡಿದರು, ಆದರೆ SpaceX ಮುಖ್ಯಸ್ಥ ಮಸ್ಕ್ ಇದನ್ನು ಆಗಸ್ಟ್ 14 ರಂದು ಶೀರ್ಷಿಕೆಯೊಂದಿಗೆ ಹಂಚಿಕೊಂಡಿದ್ದಾರೆ. ಮಸ್ಕ್ ಅವರ ಪೋಸ್ಟ್ 100 ಮಿಲಿಯನ್ ವೀಕ್ಷಣೆಗಳನ್ನು ದಾಟಿದರೆ, ಮಾಜಿ ಯುಎಸ್ ಅಧ್ಯಕ್ಷರು ಪೋಸ್ಟ್ ಮಾಡಿದ ಪೋಸ್ಟ್ 30 ಮಿಲಿಯನ್ ವೀಕ್ಷಣೆಗಳನ್ನು ತಲುಪಿದೆ.ಎಲೋನ್ ಮಸ್ಕ್ ಹಂಚಿಕೊಂಡಿರುವ ವಿಡಿಯೊದಲ್ಲಿ ದ್ವೇಷಿಗಳು ಇದನ್ನು ಎಐ ಎನ್ನುತ್ತಾರೆ ಎಂದಿದ್ದಾರೆ..ರಿಪಬ್ಲಿಕನ್ ಅಧ್ಯಕ್ಷೀಯ ಅಭ್ಯರ್ಥಿಯೊಂದಿಗೆ ಎಲೋನ್ ಮಸ್ಕ್ ಅವರ ಸಂದರ್ಶನದ ಕೆಲವು ದಿನಗಳ ನಂತರ ವೀಡಿಯೊ ಕಾಣಿಸಿಕೊಂಡಿತು, ಇದನ್ನು ಎಕ್ಸ್‌ನಲ್ಲಿ ಲೈವ್‌ಸ್ಟ್ರೀಮ್ ಮಾಡುತ್ತಿದ್ದ ವೇಳೆ ತಾಂತ್ರಿಕ ದೋಷದಿಂದಾಗಿ ಸುಮಾರು 40 ನಿಮಿಷಗಳ ಕಾಲ ವಿಳಂಬವಾಯಿತು.ಪೆನ್ಸಿಲ್ವೇನಿಯಾದ ಬಟ್ಲರ್‌ನಲ್ಲಿ ನಡೆದ ಪ್ರಚಾರ ಸಭೆ ವೇಳೆ ಯುಎಸ್ ಮಾಜಿ ಅಧ್ಯಕ್ಷರು ಹತ್ಯೆಯ ಪ್ರಯತ್ನದಿಂದ ಬದುಕುಳಿದ ದಿನಗಳ ನಂತರ ಜುಲೈನಲ್ಲಿ ಎಲೋನ್ ಮಸ್ಕ್ ಅವರು ಡೊನಾಲ್ಡ್ ಟ್ರಂಪ್‌ಗೆ ಎಕ್ಸ್ ನಲ್ಲಿ ಅನುಮತಿ ನೀಡಿದ್ದರು..Follow KannadaPrabha channel on WhatsApp  KannadaPrabha News app ಡೌನ್‌ಲೋಡ್ ಮಾಡಿ, ಇತ್ತೀಚಿನ ಸುದ್ದಿಗಳ ಅಪ್ಡೇಟ್ಸ್ ಪಡೆಯಿರಿ"
ಇಸ್ರೇಲ್ ಗೆ ಹತ್ತಿರ ಆಗಲು ಯತ್ನ:  ಹತ್ಯೆಯ ಅಪಾಯ ಎದುರಿಸುತ್ತಿರುವ ಸೌದಿ ಅರೇಬಿಯಾದ ರಾಜ ಮುಹಮ್ಮದ್ ಬಿನ್ ಸಲ್ಮಾನ್!,ಗಾಜಾದಲ್ಲಿ ನಡೆಯುತ್ತಿರುವ ಯುದ್ಧದ ಮಧ್ಯೆ ಇಸ್ರೇಲ್ ಜೊತೆಗಿನ ತೊಂದರೆಗೊಳಗಾದ ಸಂಬಂಧಗಳನ್ನು ಮರು ಸಮತೋಲನಗೊಳಿಸಲು ಸೌದಿ ಅರೇಬಿಯಾದ ಪ್ರಯತ್ನಗಳು ಕಿರೀಟ ರಾಜಕುಮಾರ ಮೊಹಮ್ಮದ್ ಬಿನ್ ಸಲ್ಮಾನ್ ಹತ್ಯೆಗೆ ಕಾರಣವಾಗಬಹುದು.,"ರಿಯಾದ್: ಸೌದಿ ಅರೇಬಿಯಾದ ರಾಜ ಮುಹಮ್ಮದ್ ಬಿನ್ ಸಲ್ಮಾನ್, ಇಸ್ರೇಲ್ ನೊಂದಿಗಿನ ದ್ವಿಪಕ್ಷೀಯ ಸಂಬಂಧ ಸುಧಾರಣೆಗೆ ಮುಂದಾಗುತ್ತಿದ್ದು ಹತ್ಯೆಯ ಅಪಾಯ ಎದುರಿಸುವಂತಾಗಿದೆ. ಇಸ್ರೆಲ್-ಗಾಜ ನಡುವಿನ ಯುದ್ಧದ ಸಂದರ್ಭದಲ್ಲಿ ಸಲ್ಮಾನ್ ಅವರ ಈ ನಡೆ ಅವರಿಗೆ ಅಪಾಯವನ್ನು ತಂದೊಡ್ಡುವ ಸಾಧ್ಯತೆ ಇದೆ ಎಂದು ಅಮೇರಿಕಾದ ವೆಬ್ ಸೈಟ್ ಒಂದು ವರದಿ ಪ್ರಕಟಿಸಿದೆ.ಇಸ್ರೇಲ್ ಜೊತೆಗಿನ ಸಂಬಂಧ ಸುಧಾರಣೆ ಕುರಿತು ಅಮೇರಿಕದ ಜನಪ್ರತಿನಿಧಿಗಳೊಂದಿಗಿನ ಮಾತುಕತೆ ವೇಳೆ ಸೌದಿ ಅರೇಬಿಯಾದ ರಾಜ, ಶಾಂತಿ ಮಾತುಕತೆಗೆ ಮುಂದಾಗುತ್ತಿರುವುದಕ್ಕೆ ತಮಗೆ ಹತ್ಯೆಯ ಅಪಾಯವಿದೆ ಎಂದು ಹೇಳಿರುವುದನ್ನು ಅಮೇರಿಕಾದ ವೆಬ್ ಸೈಟ್ ಪೊಲಿಟಿಕೋ ವರದಿ ಮಾಡಿದೆ..ಅಮೇರಿಕಾ- ಇಸ್ರೇಲ್ ಜೊತೆ ಮಾತುಕತೆ ನಡೆಸಲು ತಮ್ಮ ಜೀವವನ್ನೇ ಪಣಕ್ಕೆ ಇಟ್ಟಿರುವುದಾಗಿ ಅಮೇರಿಕಾ ಜನಪ್ರತಿನಿಧಿಗಳಿಗೆ ಸಲ್ಮಾನ್ ಹೇಳಿದ್ದಾರೆ.ಯುಎಸ್ ಕಾಂಗ್ರೆಸ್ ಶಾಸಕರೊಂದಿಗಿನ ಅವರ ಸಂಭಾಷಣೆಯೊಂದರಲ್ಲಿ, ಸೌದಿ ಕ್ರೌನ್ ಪ್ರಿನ್ಸ್ ಮೊಹಮ್ಮದ್ ಬಿನ್ ಸಲ್ಮಾನ್ ಇಸ್ರೇಲ್ನೊಂದಿಗೆ ಶಾಂತಿ ಒಪ್ಪಂದವನ್ನು ಮೊಹರು ಮಾಡಿದ ನಂತರ ಕೊಲ್ಲಲ್ಪಟ್ಟ ಈಜಿಪ್ಟ್ ನಾಯಕ ಅನ್ವರ್ ಸಾದತ್ ಅವರನ್ನು ಉಲ್ಲೇಖಿಸಿದ್ದಾರೆ. ವರದಿಯ ಪ್ರಕಾರ, ಸಾದತ್ ಅವರನ್ನು ರಕ್ಷಿಸಲು ಯುಎಸ್ ಏನು ಮಾಡಿದೆ ಎಂದು ಅವರು ಕೇಳಿದರು. ಸೌದಿ ಅರೇಬಿಯಾದೊಂದಿಗಿನ ಒಪ್ಪಂದವನ್ನು ಅಂತಿಮಗೊಳಿಸಲು ಅವರು ಎದುರಿಸುತ್ತಿರುವ ಬೆದರಿಕೆಗಳ ಬಗ್ಗೆ ಅವರು ಚರ್ಚಿಸಿದರು ಮತ್ತು ಗಾಜಾದಲ್ಲಿನ ಯುದ್ಧದಿಂದಾಗಿ ಈಗಾಗಲೇ ಇಸ್ರೇಲ್ ವಿರುದ್ಧ ಹೋರಾಡುತ್ತಿರುವ ಅರಬ್ ರಾಷ್ಟ್ರಗಳನ್ನು ಕೆರಳಿಸುವ ಸಾಧ್ಯತೆಯಿರುವುದನ್ನೂ ಅವರು ವಿವರಿಸಿದ್ದಾರೆ..ಸೌದಿ ರಾಜ ಮುಹಮ್ಮದ್ ಬಿನ್ ಸಲ್ಮಾನ್ ಭೇಟಿ ದಿಢೀರ್ ಮುಂದೂಡಿಕೆ: ನೆರವಿನ ನಿರೀಕ್ಷೆಯಲ್ಲಿದ್ದ ಪಾಕ್ ಗೆ ತೀವ್ರ ನಿರಾಸೆ! .ಅಮೇರಿಕಾ, ಇಸ್ರೆಲ್ ಜೊತೆಗಿನ ಒಪ್ಪಂದದ ಬಗ್ಗೆ ""ಅವರು ಹೇಳಿದ ರೀತಿಯಲ್ಲಿ, 'ಸೌದಿಗಳು ಇದರ ಬಗ್ಗೆ ಬಹಳ ಕಾಳಜಿ ವಹಿಸುತ್ತಾರೆ, ಮತ್ತು ಮಧ್ಯಪ್ರಾಚ್ಯದಾದ್ಯಂತ ಬೀದಿಗಳು ಇದರ ಬಗ್ಗೆ ಆಳವಾಗಿ ಕಾಳಜಿ ವಹಿಸುತ್ತವೆ ಮತ್ತು ಒಪ್ಪಂದ ನಡೆದರೆ ಇಸ್ಲಾಂನ ಪವಿತ್ರ ಸ್ಥಳಗಳ ರಕ್ಷಕನಾಗಿ ನನ್ನ ಅಧಿಕಾರಾವಧಿಯು ಸುರಕ್ಷಿತವಾಗಿರುವುದಿಲ್ಲ ಎಂದು ಹೇಳಿದ್ದಾರೆ..Follow KannadaPrabha channel on WhatsApp  KannadaPrabha News app ಡೌನ್‌ಲೋಡ್ ಮಾಡಿ, ಇತ್ತೀಚಿನ ಸುದ್ದಿಗಳ ಅಪ್ಡೇಟ್ಸ್ ಪಡೆಯಿರಿ"
"ಮಾಜಿ ಕ್ರಿಕೆಟಿಗ ಅಂಶುಮಾನ್ ಗಾಯಕ್ವಾಡ್ ಕ್ಯಾನ್ಸರ್ ನಿಂದ ನಿಧನ: ಪ್ರಧಾನಿ ಮೋದಿ, ಬಿಸಿಸಿಐ ಸೇರಿ ಹಲವರು ಕಂಬನಿ","ಆಟಗಾರನಾಗಿ ನಿವೃತ್ತಿಯಾದ ನಂತರ ವಿವಿಧ ಸಾಮರ್ಥ್ಯಗಳಲ್ಲಿ ಆಟಕ್ಕೆ ಸೇವೆ ಸಲ್ಲಿಸಿದ ಭಾರತದ ಮಾಜಿ ಕ್ರಿಕೆಟಿಗ ಅನ್ಶುಮಾನ್ ಗೇಕ್ವಾಡ್, ಕ್ಯಾನ್ಸರ್ನೊಂದಿಗಿನ ಸುದೀರ್ಘ ಯುದ್ಧದ ನಂತರ ಬುಧವಾರ ನಿಧನರಾದರು.ಅವರಿಗೆ 71 ವರ್ಷ.","ನವದೆಹಲಿ: ದೀರ್ಘಕಾಲದ ಕ್ಯಾನ್ಸರ್‌ನಿಂದ ಬಳಲುತ್ತಿದ್ದ ಭಾರತದ ಮಾಜಿ ಕ್ರಿಕೆಟಿಗ ಅಂಶುಮಾನ್ ಗಾಯಕ್ವಾಡ್ ಅವರು ಕಳೆದ ರಾತ್ರಿ ನಿಧನರಾಗಿದ್ದಾರೆ. ಅವರಿಗೆ 71 ವರ್ಷ ವಯಸ್ಸಾಗಿತ್ತು. ಗಾಯಕ್ವಾಡ್ ಭಾರತಕ್ಕಾಗಿ 40 ಟೆಸ್ಟ್ ಮತ್ತು 15 ಏಕದಿನ ಪಂದ್ಯಗಳನ್ನು ಆಡಿದ್ದಾರೆ. ಭಾರತದ ಮಾಜಿ ಕೋಚ್ ಮತ್ತು ರಾಷ್ಟ್ರೀಯ ಆಯ್ಕೆಗಾರರೂ ಆಗಿದ್ದ ಗಾಯಕ್ವಾಡ್ ಅವರು ಕಳೆದ ತಿಂಗಳು ದೇಶಕ್ಕೆ ಹಿಂತಿರುಗುವ ಮೊದಲು ಲಂಡನ್‌ನ ಕಿಂಗ್ಸ್ ಕಾಲೇಜು ಆಸ್ಪತ್ರೆಯಲ್ಲಿ ರಕ್ತದ ಕ್ಯಾನ್ಸರ್‌ಗೆ ಚಿಕಿತ್ಸೆ ಪಡೆಯುತ್ತಿದ್ದರು.ಗಾಯಕ್ವಾಡ್ ಅವರ ಚಿಕಿತ್ಸೆಗಾಗಿ ಬಿಸಿಸಿಐ ಒಂದು ಕೋಟಿ ರೂಪಾಯಿ ಧನಸಹಾಯ ಮಾಡಿತ್ತು. 1983 ರ ವಿಶ್ವಕಪ್ ವಿಜೇತ ತಂಡದ ಸದಸ್ಯರು ಕೂಡ ಆರ್ಥಿಕ ಸಹಾಯ ಮಾಡಿದ್ದರು..ಗಾಯಕ್ವಾಡ್ ಅವರು ತಮಮ್ 22 ವರ್ಷಗಳ ವೃತ್ತಿಜೀವನದಲ್ಲಿ 205 ಪ್ರಥಮ ದರ್ಜೆ ಪಂದ್ಯಗಳನ್ನು ಆಡಿದ್ದಾರೆ. ನಂತರ ಅವರು ಭಾರತ ತಂಡದ ಕೋಚ್ ಆಗಿ ಅಧಿಕಾರ ವಹಿಸಿಕೊಂಡಿದ್ದರು.1998 ರಲ್ಲಿ ಶಾರ್ಜಾದಲ್ಲಿ ಮತ್ತು ದೆಹಲಿಯ ಫಿರೋಜ್‌ಶಾ ಕೋಟ್ಲಾದಲ್ಲಿ ನಡೆದ ಟೆಸ್ಟ್ ಪಂದ್ಯದಲ್ಲಿ ಅನಿಲ್ ಕುಂಬ್ಳೆ ಅವರು 1999 ರಲ್ಲಿ ಪಾಕಿಸ್ತಾನದ ವಿರುದ್ಧ ಇನ್ನಿಂಗ್ಸ್‌ನಲ್ಲಿ ಎಲ್ಲಾ 10 ವಿಕೆಟ್‌ಗಳನ್ನು ಪಡೆದದ್ದು ಅವರ ವೃತ್ತಿಜೀವನದ ಅದ್ಬುತ ಕ್ಷಣಗಳಾಗಿದ್ದವು..ಗಾಯಕ್ವಾಡ್ ಕ್ಯಾನ್ಸರ್ ಚಿಕಿತ್ಸೆಗೆ ಬಿಸಿಸಿಐ 1 ಕೋಟಿ ರೂ ಆರ್ಥಿಕ ನೆರವು!.ಅಂಶುಮಾನ್ ಗಾಯಕ್ವಾಡ್ ಅವರ ನಿಧನಕ್ಕೆ ಪ್ರಧಾನಿ ನರೇಂದ್ರ ಮೋದಿ ಸೇರಿದಂತೆ ಅನೇಕ ಗಣ್ಯರು ಸಂತಾಪ ಸೂಚಿಸಿದ್ದಾರೆ.ಕ್ರಿಕೆಟ್‌ಗೆ ನೀಡಿದ ಕೊಡುಗೆಗಾಗಿ ಶ್ರೀ ಅಂಶುಮಾನ್ ಗಾಯಕ್ವಾಡ್ ಅವರನ್ನು ಸ್ಮರಿಸಲಾಗುವುದು. ಅವರು ಪ್ರತಿಭಾನ್ವಿತ ಆಟಗಾರ ಮತ್ತು ಅತ್ಯುತ್ತಮ ತರಬೇತುದಾರರಾಗಿದ್ದರು. ಅವರ ನಿಧನದಿಂದ ನೋವಾಗಿದೆ. ಅವರ ಕುಟುಂಬ ಮತ್ತು ಅಭಿಮಾನಿಗಳಿಗೆ ಸಂತಾಪಗಳು. ಓಂ ಶಾಂತಿ"" ಎಂದು ಪ್ರಧಾನಿ ಮೋದಿ ಟ್ವೀಟ್ ಮಾಡಿದ್ದಾರೆ.ಬಿಸಿಸಿಐ ಕಾರ್ಯದರ್ಶಿ ಜಯ್ ಶಾ ಕೂಡ ದಿವಂಗತ ಕ್ರಿಕೆಟಿಗನಿಗೆ ಶ್ರದ್ಧಾಂಜಲಿ ಸಲ್ಲಿಸಿದ್ದಾರೆ. 1974 ಮತ್ತು 1984 ರ ನಡುವೆ, ಅವರು ಭಾರತೀಯ ತಂಡದಲ್ಲಿ ಸುನಿಲ್ ಗವಾಸ್ಕರ್ ಪಾಲುದಾರರಾಗಿ ಎರಡನೇ ಓಪನರ್ ಆಗಿದ್ದರು..ಅವರು ರಾಷ್ಟ್ರೀಯ ಕ್ರಿಕೆಟ್ ಆಟಗಾರರ ಆಯ್ಕೆಗಾರರಾಗಿ ಸೇವೆ ಸಲ್ಲಿಸಿದರು, ಬರೋಡಾ ಕ್ರಿಕೆಟ್ ಅಸೋಸಿಯೇಷನ್‌ನ ಮುಖ್ಯಸ್ಥರಾಗಿದ್ದರು. ಅನಾರೋಗ್ಯಕ್ಕೆ ತುತ್ತಾಗುವ ಮೊದಲು ಅವರು ಭಾರತೀಯ ಕ್ರಿಕೆಟ್ ಅಸೋಸಿಯೇಷನ್ ನ ಪ್ರತಿನಿಧಿಯಾಗಿ ಬಿಸಿಸಿಐ ಅಪೆಕ್ಸ್ ಕೌನ್ಸಿಲ್ ಸದಸ್ಯರಾಗಿದ್ದರು.ಕ್ರಿಕೆಟ್ ದಿಗ್ಗಜರಾದ ಗವಾಸ್ಕರ್, ಕಪಿಲ್ ದೇವ್, ಭಾರತದ ಮಾಜಿ ಕೋಚ್ ರವಿಶಾಸ್ತ್ರಿ, ಕ್ಲೈವ್ ಲಾಯ್ಡ್, ಆಂಡಿ ರಾಬರ್ಟ್ಸ್, ಫಾರೋಖ್ ಇಂಜಿನಿಯರ್, ಭಾರತದ ಮಾಜಿ ನಾಯಕ ದಿಲೀಪ್ ವೆಂಗ್‌ಸರ್ಕರ್, ಬಿಸಿಸಿಐ ಅಧ್ಯಕ್ಷ ರೋಜರ್ ಬಿನ್ನಿ, ಮೊಹಿಂದರ್ ಅಮರನಾಥ್, ಸಂದೀಪ್ ಪಾಟೀಲ್, ಕರ್ಸನ್ ಘಾವ್ರಿ, ಬಲ್ವಿಂದರ್ ಸಿಂಗ್ ಸಂಧು ಮತ್ತು ನಟ ನಾನಾ ಪಾಟೇಕರ್ ಅವರು ಕೊನೆಯುಸಿರೆಳೆಯುವ ಮೊದಲು ಗಾಯಕ್ವಾಡ್ ಅವರಲ್ಲಿ ಚೇತರಿಕೆ ಕಾಣಲೆಂದು ಪ್ರೋತ್ಸಾಹದಾಯಕ ಮಾತುಗಳಿಂದ ಹುರಿದುಂಬಿಸಿದ್ದರು..Follow KannadaPrabha channel on WhatsApp  KannadaPrabha News app ಡೌನ್‌ಲೋಡ್ ಮಾಡಿ, ಇತ್ತೀಚಿನ ಸುದ್ದಿಗಳ ಅಪ್ಡೇಟ್ಸ್ ಪಡೆಯಿರಿ"
ಬೆಂಗಳೂರು: ನೂತನ ರಾಷ್ಟ್ರೀಯ ಕ್ರಿಕೆಟ್ ಅಕಾಡೆಮಿ ಉದ್ಘಾಟನೆಗೆ ಸಜ್ಜು!,ಹೊಸ ರಾಷ್ಟ್ರೀಯ ಕ್ರಿಕೆಟ್ ಅಕಾಡೆಮಿ (ಎನ್‌ಸಿಎ) ಶೀಘ್ರದಲ್ಲೇ ಇಲ್ಲಿ ಉದ್ಘಾಟಿಸಲು ಸಿದ್ಧವಾಗಿದೆ ಮತ್ತು ಇದು 45 ಅಭ್ಯಾಸ ಪಿಚ್‌ಗಳನ್ನು ಮತ್ತು ಒಲಿಂಪಿಕ್ಸ್ ಗಾತ್ರದ ಈಜುಕೊಳವನ್ನು ಮತ್ತು ಇತರ ಸೌಲಭ್ಯಗಳನ್ನು ಹೊಂದಿರುತ್ತದೆ ಎಂದು ಬಿಸಿಸಿಐ ಕಾರ್ಯದರ್ಶಿ ಜೇ ಶಾ ಶನಿವಾರ ಹೇಳಿದ್ದಾರೆ.,"ಬೆಂಗಳೂರು: ಬಿಸಿಸಿಐ ಉದ್ಯಾನನಗರಿ ಬೆಂಗಳೂರಿನಲ್ಲಿ ನಿರ್ಮಾಣ ಮಾಡುತ್ತಿರುವ  ನೂತನ ರಾಷ್ಟ್ರೀಯ ಕ್ರಿಕೆಟ್ ಅಕಾಡೆಮಿ ಬಹುತೇಕ ಪೂರ್ಣಗೊಂಡಿದ್ದು, ಉದ್ಘಾಟನೆಗೆ ಸಜ್ಜಾಗಿದೆ.  45 ಅಭ್ಯಾಸದ ಪಿಚ್‌ಗಳು ಮತ್ತು ಒಲಿಂಪಿಕ್ಸ್ ಗಾತ್ರದ ಈಜುಕೊಳ ಮತ್ತಿತರ ಸೌಲಭ್ಯವಿರುವ ಅಕಾಡೆಮಿಯನ್ನು ಶೀಘ್ರದಲ್ಲಿಯೇ ಉದ್ಘಾಟಿಸಲಾಗುವುದು ಎಂದು ಎಂದು ಬಿಸಿಸಿಐ ಕಾರ್ಯದರ್ಶಿ ಜಯ್ ಶಾ ಶನಿವಾರ ತಿಳಿಸಿದ್ದಾರೆ.ಈ ಕುರಿತು ಸಾಮಾಜಿಕ ಜಾಲತಾಣ ಎಕ್ಸ್ ನಲ್ಲಿ ಮಾಹಿತಿ ಹಂಚಿಕೊಂಡಿರುವ ಜಯ್ ಶಾ, ನೂತನ ರಾಷ್ಟ್ರೀಯ ಕ್ರಿಕೆಟ್ ಅಕಾಡೆಮಿಯಲ್ಲಿ ಮೂರು ವಿಶ್ವ ದರ್ಜೆಯ ಆಟದ ಮೈದಾನಗಳು, 45 ಅಭ್ಯಾಸದ ಪಿಚ್‌ಗಳು, ಒಳಾಂಗಣ ಕ್ರಿಕೆಟ್ ಪಿಚ್‌ಗಳು, ಒಲಿಂಪಿಕ್ ಗಾತ್ರದ ಈಜುಕೊಳ ಮತ್ತು ಅತ್ಯಾಧುನಿಕ ತರಬೇತಿ, ಕ್ರೀಡಾ ವಿಜ್ಞಾನ ಸೌಲಭ್ಯಗಳಿವೆ ಎಂದು ತಿಳಿಸಿದ್ದಾರೆ. .ಮಾಜಿ ಕ್ರಿಕೆಟಿಗ ಅಂಶುಮಾನ್ ಗಾಯಕ್ವಾಡ್ ಕ್ಯಾನ್ಸರ್ ನಿಂದ ನಿಧನ: ಪ್ರಧಾನಿ ಮೋದಿ, ಬಿಸಿಸಿಐ ಸೇರಿ ಹಲವರು ಕಂಬನಿ.ನೂತನ ರಾಷ್ಟ್ರೀಯ ಅಕಾಡೆಮಿಯಿಂದ ದೇಶದ ಪ್ರಸ್ತುತ ಮತ್ತು ಭವಿಷ್ಯದ ಕ್ರಿಕೆಟಿಗರು ಉತ್ತಮ ವಾತಾವರಣದಲ್ಲಿ ತಮ್ಮ ಕೌಶಲ್ಯಗಳನ್ನು ಬೆಳೆಸಿಕೊಳ್ಳಲು  ನೆರವಾಗುತ್ತದೆ ಎಂದು ಅವರು ಹೇಳಿದ್ದಾರೆ.  ಪ್ರಸ್ತುತ  NCA ಎಂ ಚಿನ್ನಸ್ವಾಮಿ ಕ್ರೀಡಾಂಗಣದ ಆವರಣದಲ್ಲಿದ್ದು, ಜಮ್ಮು- ಕಾಶ್ಮೀರ ಹಾಗೂ ಈಶಾನ್ಯ ಭಾರತದಲ್ಲಿ ಎನ್‌ಸಿಎಗಳನ್ನು ಪ್ರಾರಂಭಿಸಲು ಬಿಸಿಸಿಐ ಪ್ರಕ್ರಿಯೆ ಆರಂಭಿಸಿದೆ. .Follow KannadaPrabha channel on WhatsApp  KannadaPrabha News app ಡೌನ್‌ಲೋಡ್ ಮಾಡಿ, ಇತ್ತೀಚಿನ ಸುದ್ದಿಗಳ ಅಪ್ಡೇಟ್ಸ್ ಪಡೆಯಿರಿ"
